dataset,image_file,label_file,status,reference_text,ocr_text,ref_chars,ref_words,cer,wer,ocr_time_sec,error
original,A10.jpg,labelA10.txt,ok,"Water/Aqua/Eau, Glycerin, Dipropylene Glycol, Caprylic/Capric Triglyceride, Hydrogenated Poly(C6-14 Olefin), Hydrogenated Polydecene, Cetearyl Alcohol, 1,2-Hexanediol, Cyclomethicone, Dimethicone, Vegetable Oil/Huile Végétale, Bifida Ferment Lysate, Cyclopentasiloxane, Dimethiconol, Glyceryl Stearate SE, Cetearyl Glucoside, Cetearyl Olivate, Sorbitan Olivate, C12-16 Alcohols, Ceramide NP, Amaranthus Caudatus Seed Extract, Ulmus Davidiana Root Extract, Microcrystalline Cellulose, Hydroxyethyl Acrylate/Sodium Acryloyldimethyl Taurate Copolymer, Squalane, Glyceryl Stearate, PEG-100 Stearate, Hydrogenated Lecithin, Palmitic Acid, Coco-Caprylate/Caprate, Beta Vulgaris (Beet) Root Extract, Portulaca Oleracea Extract, Pueraria Thunbergiana Root Extract, Cnidium Officinale Root Extract, Glycyrrhiza Glabra (Licorice) Root Extract, Paeonia Lactiflora Root Extract, Polysorbate 60, Caramel, Cellulose Gum, Sodium Hyaluronate, Citrus Aurantium Bergamia (Bergamot) Fruit Oil, Hydrolyzed Corn Starch, Soluble Collagen, Pelargonium Graveolens Flower Oil, Propylene Glycol, Butylene Glycol, Aloe Barbadensis Leaf Juice, Disodium EDTA, Panthenol, Acacia Senegal Gum, Algae Extract, Artemisia Vulgaris Extract, Folic Acid, Salvia Officinalis (Sage) Oil, Acetic Acid, Pogostemon Cablin Oil, Cholesterol, Raffinose, Lactic Acid, Xanthan Gum, Tromethamine, Palmitoyl Pentapeptide-4",,1372,148,1.0,1.0,0.3588,
original,A12.jpg,labelA12.txt,ok,"Water, Dipropylene Glycol, Glycerin, Methyl Trimethicone, Alcohol Denat, Dimethicone, Cyclopentasiloxane, 1,2-Hexanediol, Malachite Extract, Caprylic/Capric Triglyceride, Pentaerythrityl Tetraethylhexanoate, PEG/PPG/Polybutylene Glycol-8/5/3 Glycerin, Alchemilla Vulgaris Leaf Extract, Equisetum Arvense Leaf Extract, Stellaria Media (Chickweed) Extract, Urtica Dioica (Nettle) Leaf Extract, Plantago Lanceolata Leaf Extract, Avena Sativa (Oat) Kernel Extract, Calendula Officinalis Flower Extract, Nepeta Cataria Extract, Rubus Idaeus (Raspberry) Leaf Extract, Baptisia Tinctoria Root Extract, Dimethiconol, Polymethylsilsesquioxane, Sodium Acrylate/Acryloyldimethyltaurate/Dimethylacrylamide Crosspolymer, Isohexadecane, Polysorbate 60, Ceramide 3, Cholesterol, Butyrospermum Parkii (Shea) Butter, Phenyl Trimethicone, Pentaerythrityl Tetraisostearate, Panthenol, Squalane, Triethylhexanoin, Macadamia Ternifolia Seed Oil, PEG-150, PEG-40 Hydrogenated Castor Oil, Acrylates/C10-30 Alkyl Acrylate Crosspolymer, C14-22 Alcohols, Arachidyl Glucoside, Hydrogenated Lecithin, PEG-100 Stearate, Stearic Acid, Glyceryl Stearate, Carbomer, Tromethamine, Trisodium EDTA, Fragrance, Citronellol, Limonene, Citral, Geraniol, Linalool","Ingredients: Water, Dipropylene Glycol, Glycerin, Methl Trimethicone, Alcohol Denat, Dimethicone, Cyclopentasiloxane, 1,2-Hexanediol, Malakite Extract, Caprylic/Capric Triglyceride, Pentaerythrityl Tetraethylhexanoate, PEG/PPG/Polybutylene Glycol-8/5/3 Glycerin, Alchemilla Vulgaris Leaf Extract*, Equisetum Arvense Leaf Extract*, Stellaria Media (Chickweed) Extract*, Urtica Dioica (Nettle) Leaf Extract*, Plantago Lanceolata Leaf Extract*, Avena Sativa (Oat) Kernel Extract**, Calendula Officinalis Flower Extract** Nepeta Cataria Extract**, Rubus Idaeus (Raspberry) Leaf Extract**, Baptisia Tinctoria Root Extract**, Dimethiconol, Polymethylsilsesquioxane, Sodium Acrylate/ Acryloyldimethyltaurate/Dimethylacrylamide Crosspolymer, Isohexadecane, Polysorbate 60, Ceramide 3, Cholesterol, Butyrospermum Parkii (Shea) Butter, Phenl Trimethicone, Pentaerythrityl Tetraisostearate, Panthenol, Squalane, Triethylhexanoin, Macadamia Ternifolia Seed Oil, PEG-150, PEG-40 Hydrogenated Castor Oil, Acrylates/C10-30 Alkyl Acrylate Crosspolymer, C14-22 Alcohols, Arachidyl Glucoside Hydrogenated Lecithin, PEG-100 Stearate, Stearic Acid, Glyceryl Stearate, Carbomer, Tromethamine, Trisodium EDTA, Fragrance+, Citronellol, Limonene, Citral, Geraniol, Linalool. www.thebeautyinsideout.com",1224,119,0.0515,0.1681,0.7157,
original,A14.jpg,labelA14.txt,ok,"Water, Squalane, Glycerin, Pentylene Glycol, Polyglyceryl-2 Stearate, Glyceryl Stearate, Stearyl Alcohol, Ceramide NG, Ceramide EOP, Ceramide NP, Ceramide AS, Ceramide AP, Carnosine, Hydrogenated Lecithin, Cholesterol, Caprylyl Glycol, Polyacrylate Crosspolymer-11, 1,2-Hexanediol",,280,30,1.0,1.0,0.031,
original,A15.jpg,labelA15.txt,ok,"Centella Asiatica Extract (72%), Glycerin, Propanediol, Dipropylene Glycol, Cyclomethicone, Water, 1,2-Hexanediol, Trehalose, Caprylyl Methicone, C12-14 Pareth-12, Carbomer, Tromethamine, Ammonium Acryloyldimethyltaurate/VP Copolymer, C30-45 Alkyl Cetearyl Dimethicone Crosspolymer, Xanthan Gum, Mentha Piperita (Peppermint) Leaf Extract, Zingiber Officinale (Ginger) Root Extract, Butylene Glycol, Ethylhexylglycerin, Dipotassium Glycyrrhizate, Tranexamic Acid, Coptis Chinensis Root Extract, Theobroma Cacao (Cocoa) Extract, Dextrin, Leuconostoc/Radish Root Ferment Filtrate, Biosaccharide Gum-1, Disodium EDTA, Sodium Hyaluronate, Beta-Glucan, Ceramide EOP, Ceramide NS, Ceramide NP, Ceramide AP, Phytosphingosine, Hydrogenated Lecithin, Cetearyl Alcohol, Stearic Acid, Cholesterol","INGREDIENTS Centella Asiatica Extract(72%), Glycerin, Propanediol, Dipro pylene Glycol, Cyclomethicone, Water, 1,2-Hexanediol, Trehalose, Caprylyl Methicone, Cl2-14 Pareth-12, Carbomer, Tromethamine, Ammonium Ac- ryloyldimethyltaurate/VP Copolymer, C3o-45 Alkyl Cetearyl Dimethicone Crosspolymer, Xanthan Gum, Mentha Piperita (Peppermint) Leaf Extract, Zingiber Officinale (Ginger) Root Extract, Butylene Glycol, Ethylhexylglyce- rin, Dipotassium Glycyrrhizate, Tranexamic Acid, Coptis Chinensis Root Ex- tract,Theobroma Cacao(Cocoa) Extract,Dextrin, Leuconostoc/Radish Root Ferment Filtrate, Biosäccharide Gum-1, Disodium EDTA, Sodium Hyaluro- nate, Beta-Glucan, Ceramide EOP, Ceramide NS, Ceramide NP, Ceramide AP, Phytosphingosine, Hydrogenated Lecithin, Cetearyl Alcohol, Stearic Acid,Cholesterol",784,81,0.037,0.2716,0.4023,
original,A16.jpg,labelA16.txt,ok,"Aqua, Glycerin, Mineral Oil, Polyglyceryl-3 Methylglucose Distearate, Cetyl Palmitate, Niacinamide, Dimethicone, Acrylates/C10-30 Alkyl Acrylate Crosspolymer, Stearic Acid, Borago Officialis Seed Oil, Caprylyl Glycol, Carbomer, Cetyl Alcohol, Disodium EDTA, Lactic Acid, Panthenol, Pentylene Glycol, Phenoxyethanol, Potassium Carbonate, Potassium Hydroxide, Citric Acid, Bisabolol, Serine, Sodium Lactate, Sorbitol, Tocopheryl Acetate, Urea, Allantoin, Sodium Chloride","INGREDIENTS: AQUA, GLYCERIN, MINERAL OIL, POLYGLYCERYL-3 METHYLGLUCOSE DISTEARATE, CETYL PALMITATE, NIACINAMIDE, DIMETHICONE, ACRYLATES/C1O-3O ALKYL ACRYLATE CROSSPOLYMER, STEARIC ACID, BORAGO OFFICIALIS SEED OIL, CAPRYLYL GLYCOL, CARBOMER, CETYL ALCOHOL, DISODIUM EDTA, LACTIC ACID, PANTHENOL, PENTYLENE GLYCOL, PHENOXYETHANOL, POTASSIUM CARBONATE, POTASSIUM HYDROXIDE, CITRIC ACID, BISABOLOL, SERINE, SODIUM LACTATE, SORBITOL, TOCOPHERYL ACETATE, UREA, ALLANTOIN, SODIUM CHLORIDE.",468,51,0.0342,0.0588,0.3401,
original,A18.jpg,labelA18.txt,ok,"Aqua, Glycerin, Petrolatum, Dicaprylyl Ether, Dimethicone, Glyceryl Stearate, Cetyl Alcohol, Helianthus Annuus Seed Oil, PEG-30 Glyceryl Stearate, Panthenol, Niacinamide, Prunus Amygdalus Dulcis Oil, Tocopheryl Acetate, Isopropyl Palmitate, Acrylates/C10-30 Alkyl Acrylate Crosspolymer, Propylene Glycol, BHT, Disodium EDTA, Benzoic Acid, Phenoxyethanol, Sodium Hydroxide, Citric Acid",,384,43,1.0,1.0,0.0362,
original,A19.jpg,labelA19.txt,ok,"Water/Aqua/Eau, Butylene Glycol, Glycerin, Squalane, Pentaerythrityl Tetraethylhexanoate, Arachidyl Alcohol, Dimethicone, Behenyl Alcohol, Butyrospermum Parkii (Shea) Butter, Cyclopentasiloxane, Arachidyl Glucoside, Cetyl Ethylhexanoate, Cyclohexasiloxane, Hydroxyethyl Acrylate/Sodium Acryloyldimethyl Taurate Copolymer, Phenoxyethanol, Panax Ginseng Root Extract, Triethylhexanoin, Butylene Glycol Dicaprylate/Dicaprate, Polyacrylate-13, PEG-10 Dimethicone, Lauryl PEG-9 Polydimethylsiloxyethyl Dimethicone, Cetyl PPG/PPG-10/1 Dimethicone, Polyisobutene, Disteardimonium Hectorite, Methoxy PEG-114/Polyepsilon Caprolactone, Fragrance/Parfum, Disodium EDTA, Sorbitan Isostearate, Ethylhexylglycerin, Honey/Mel/Miel, Polysorbate 60, Perilla Ocymoides Seed Extract, Dextrin, Hydrolyzed Ginseng Saponins (Enzyme-Treated Red Ginseng Saponins), Polysorbate 20, Lilium Candidum Bulb Extract, Rehmannia Glutinosa Root Extract, Polygonatum Officinale Rhizome/Root Extract, Nelumbo Nucifera Flower Extract, Glucose, Carthamus Tinctorius (Safflower) Flower Extract, Glycyrrhiza Uralensis (Licorice) Root Extract, 1,2-Hexanediol, Gardenia Florida Fruit Extract, Alpha-Isomethyl Ionone, Limonene, Hydrogenated Lecithin, Linalool, Panax Ginseng Flower Extract, Hydroxyisohexyl 3-Cyclohexene Carboxaldehyde, Hexyl Cinnamal, Sodium Polyaspartate, Phytosphingosine, Sodium Methyl Stearoyl Taurate, Tocopherol, Pentaerythrityl Tetra-Di-T-Butyl Hydroxyhydrocinnamate",,1449,133,1.0,1.0,0.0412,
original,A2.jpg,labelA2.txt,ok,"Aqua/Water, Glycerin, Cyclohexasiloxane, Squalane, Bis-PEG-18 Methyl Ether Dimethyl Silane, Sucrose Stearate, Stearyl Alcohol, PEG-8 Stearate, Myristyl Myristate",,161,17,1.0,1.0,0.0415,
original,A20.jpg,labelA20.txt,ok,"Aqua/Water, Glycerin, Cetearyl Alcohol, Caprylic/Capric Triglyceride, Cetyl Alcohol, Ceteth-20, Petrolatum, Potassium Phosphate, Ceramide NP, Ceramide AP, Carbomer, Behentrimonium Methosulfate, Sodium Lauroyl Lactylate, Sodium Hyaluronate, Cholesterol, Phenoxyethanol, Disodium EDTA, Dipotassium Phosphate, Tocopherol, Phytosphingosine, Xanthan Gum, Ethylhexylglycerin",,368,35,1.0,1.0,0.0414,
original,A21.jpg,labelA21.txt,ok,"Water, Glycerin, Isononyl Isononanoate, Isododecane, 1,2-Hexanediol, Pentylene Glycol, Polydecene, Betula Platyphylla Japonica Juice, Jojoba Esters, Panthenol, Glyceryl Glucoside, Acacia Senegal Gum, Hydrolyzed Hibiscus Esculentus Extract, Sodium Hyaluronate, Hyaluronic Acid, Lupinus Albus Seed Extract, Moringa Oleifera Seed Extract, Melia Azadirachta Leaf Extract, Melia Azadirachta Flower Extract, Coccinia Indica Fruit Extract, Aloe Barbadensis Flower Extract, Solanum Melongena (Eggplant) Fruit Extract, Ocimum Sanctum Leaf Extract, Corallina Officinalis Extract, Curcuma Longa (Turmeric) Root Extract, Ascorbic Acid, Pentaerythrityl Tetraethylhexanoate, Ammonium Acryloyldimethyltaurate/VP Copolymer, Polyglyceryl-3 Methylglucose Distearate, Acrylates/C10-30 Alkyl Acrylate Crosspolymer, Tromethamine, Glyceryl Acrylate/Acrylic Acid Copolymer, Ethylhexylglycerin, Agar, Dipotassium Glycyrrhizate, Glyceryl Caprylate, Butylene Glycol, Disodium EDTA","Ingredients I Water, Glycerin, Isononyl Isononanoate, Isododecane, 1,2-Hexanediol, Pentylene Glycol, Polydecene, Betula Platyphylla Japonica Juice, Jojoba Esters, Panthenol, Glyceryl Glucoside, Acacia Senegal Gum, Hydrolyzed Hibiscus Esculentus Extract, Sodium Hyaluronate, Hyaluronic Acid, Lupinus Albus Seed Extract, Moringa Oleifera Seed Extract, Melia Azadirachta Leaf Extract, Melia Azadirachta Flower Extract, Coccinia Indica Fruit Extract, Aloe Barbadensis Flower Extract, Solanum Melongena (Eggplant) Fruit Extract, Ocimum Sanctum Leaf Extract, Corallina Officinalis Extract, Curcuma Longa (Turmeric) Root Extract, Ascorbic Acid, Pentaerythrityl Tetraethyl hexanoate, Ammonium Acryloyldimethyltaurate/VP Copolymer, Polyglyceryl-3 Methyl glucose Distearate, Acrylates/C10-30 Alkyl Acrylate Crosspolymer, Tromethamine, Glyceryl Acrylate/Acrylic Acid Copolymer, Ethylhexylglycerin, Agar, Dipotassium Glycyrrhizate, Glyceryl Caprylate, Butylene Glycol, Disodium EDTA",954,99,0.0168,0.0606,0.3522,
original,A23.jpg,labelA23.txt,ok,"Water/Aqua/Eau, Butylene Glycol, Glycerin, Ethylhexyl Stearate, Dimethicone, Dicaprylyl Carbonate, Behenyl Alcohol, Stearic Acid, Palmitic Acid, Cetyl Ethylhexanoate, Hydrogenated Poly(C6-14 Olefin), 1,2-Hexanediol, Arachidyl Alcohol, C14-22 Alcohols, Cetyl-PG Hydroxyethyl Palmitamide, Polyacrylate-13, Mannitol, Arachidyl Glucoside, C12-20 Alkyl Glucoside, Hydrogenated Polyisobutene, Glyceryl Caprylate, Ethylhexylglycerin, Polyglyceryl-10 Laurate, Hydrogenated Lecithin, Ethylhexyl Palmitate, Dimethicone Methacrylate Copolymer, Panax Ginseng Root Water, Carbomer, Sorbitan Isostearate, Acrylates/Ammonium Methacrylate Copolymer, Propanediol, Cholesterol, Silica, Prunus Mume Fruit Extract, Arachidic Acid, Glycine Max (Soybean) Oil, Squalane, Madecassoside, Polyglyceryl-10 Pentastearate, Tocopherol, Ceramide NP, Oleic Acid, Phytosphingosine, Pentylene Glycol, Dipotassium Glycyrrhizate, Canola Oil/Huile de Colza, Rosmarinus Officinalis (Rosemary) Leaf Extract",,967,95,1.0,1.0,0.0381,
original,A24.jpg,labelA24.txt,ok,"Water, Butylene Glycol, Glycerin, 1,2-Hexanediol, Hydrogenated Didecene, Allantoin, Trehalose, Hamamelis Virginiana (Witch Hazel) Extract, Panthenol, Hydrolyzed Hyaluronic Acid, Sodium Hyaluronate, Glyceryl Acrylate/Acrylic Acid Copolymer, PVM/MA Copolymer, Hydroxypropyl Acrylates/Acrylic Acid Copolymer, 2,3-Butanediol, Cetearyl Alcohol, C14-22 Alcohols, C12-20 Alkyl Glucoside, Pentylene Glycol, Sorbitan Isostearate, Caprylic/Capric Triglyceride, Melia Azadirachta Leaf Extract, Melia Azadirachta Flower Extract, Citrus Aurantifolia (Lime) Extract, Ocimum Sanctum Leaf Extract, Curcuma Longa (Turmeric) Root Extract, Corallina Officinalis Extract, Hyacinthus Orientalis (Hyacinth) Extract, Chamomilla Recutita (Matricaria) Flower Extract, Centaurea Cyanus Flower Extract, Sodium Acetylated Hyaluronate, Carbomer, Tromethamine, Xanthan Gum, Malachite Extract, Ethylhexylglycerin",,881,91,1.0,1.0,0.0394,
original,A25.jpg,labelA25.txt,ok,"Water, Glycerin, 2,3-Butanediol, Niacinamide, Caprylic/Capric Triglyceride, 1,2-Hexanediol, Propanediol, Nylon-12, Coco-Caprylate/Caprate, Carbomer, Tromethamine, Sodium Polyacrylate, Polymethylsilsesquioxane, Sclerotium Gum, HDI/Trimethylol Hexyllactone Crosspolymer, Acetamide MEA, Trisodium EDTA, Sarcosine, Pentylene Glycol, Squalane, Palmitoyl Tripeptide-1, Tocopherol, Hydrogenated Lecithin, Ethylhexylglycerin, Hydrolyzed Sodium Hyaluronate, Centella Asiatica Extract, Dipotassium Glycyrrhizate, Sodium Hyaluronate Crosspolymer, Ceramide NP, Copper Tripeptide-1",,568,49,1.0,1.0,0.0401,
original,A26.jpg,,missing_label,,,,,,,0.0,
original,A27.jpg,labelA27.txt,ok,"Aqua (Water), Glycerin, Isostearyl Isostearate, Caprylic/Capric Triglyceride, Pentylene Glycol, Cetyl Alcohol, Polyglycerin-3, Potassium Cetyl Phosphate, Nylon 6/12, Hydrogenated Palm Kernel Glycerides, Boron Nitride, Dimethicone, Ethylene/Acrylic Acid Copolymer, Glyceryl Stearate, Sodium Hyaluronate, Ficus Carica Fruit Extract, Citrus × Limon (Lemon) Peel Oil, Cucumis Sativus (Cucumber) Fruit Extract, Averrhoa Carambola Leaf Extract, Algae Extract, Nelumbo Nucifera Flower Extract, Hibiscus Esculentus Fruit Extract, Tocopheryl Acetate, Ascorbyl Tetraisopalmitate, Tocopherol, Bis-Diglyceryl Polyacylalipdate-2, Sorbitol, Benzoyl Alcohol, Butylene Glycol, Carbomer, Sodium Polyacrylate, Xanthan Gum, Sodium Citrate, Sodium Hydroxide, Hydrogenated Palm Glycerides, Citric Acid, Biosaccharide Gum-2, Caramel, Caprylyl Glycol, Potassium Sorbate, Sorbic Acid, Phenoxyethanol, Limonene, Citral",,893,98,1.0,1.0,0.0518,
original,A28.jpg,labelA28.txt,ok,"Water, Glycerin, Hydrogenated Polydecene, Caprylic/Capric Triglyceride, Dipropylene Glycol, Cyclohexasiloxane, Butyrospermum Parkii (Shea) Butter, Polyglyceryl-3 Methylglucose Distearate, Cetyl Alcohol, Glycereth-26, Glyceryl Stearate, Betaine, Behenyl Alcohol, Vinyl Dimethicone, Pentylene Glycol, Laminaria Japonica Extract, Eclipta Prostrata Leaf Extract, Avena Sativa (Oat) Kernel Extract, Cynara Scolymus (Artichoke) Leaf Extract, Prunus Armeniaca (Apricot) Kernel Oil, Argania Spinosa Kernel Oil, Carthamus Tinctorius (Safflower) Seed Oil, Sodium Hyaluronate, Hydrogenated Lecithin, Camellia Sinensis Leaf Water, Polyglyceryl-10 Laurate, Pentaerythrityl Distearate, Ammonium Acryloyldimethyltaurate/VP Copolymer, Glyceryl Caprylate, Sodium Stearoyl Glutamate, Methylpropanediol, Fructooligosaccharides, Disodium EDTA, Beta-Glucan, Hydrolyzed Hyaluronic Acid, Polyquaternium-51, Butylene Glycol, Hydroxypropyl Trimonium Hyaluronate, Dimethylsilanol Hyaluronate, Hydrolyzed Sodium Hyaluronate, Potassium Hyaluronate, Hyaluronic Acid, Sodium Hyaluronate Crosspolymer, Sodium Acetylated Hyaluronate, Sodium Hyaluronate Dimethylsilanol, 1,2-Hexanediol, Hydroxyacetophenone, Ethylhexylglycerin","Ingredients Water, Glycerin, Hydrogenated Polydecene, Caprylic/Capric Triglyceride, Dipro- pylene Glycol, Cyclohexasiloxane, Butyrospe- rmum Parkii (Shea) Butter, Polyglyceryl-3 Me- thylglucose Distearate, Cetyl Alcohol, Glycereth -26, Glyceryl Stearate, Betaine, Behenyl Alcohol, Vinyl Dimethicone, Pentylene Glycol, Laminaria Japonica Extract, Eclipta Prostrata Leaf Extract, Avena Sativa (Oat) Kernel Extract, Cynara Sco- lymus (Artichoke) Leaf Extract, Prunus Armeniaca (Apricot) Kernel Oil, Argania Spinosa Kernel Oil, Carthamus Tinctorius (Safflower) Seed Oil, So- dium Hyaluronate, Hydrogenated Lecithin, Ca- mellia Sinensis Leaf Water, Polyglyceryl-10 Lau- rate, Pentaerythrityl Distearate, Ammonium Acryloyldimethyltaurate/Vp Copolymer, Glyceryl Caprylate, Sodium Stearoyl Glutamate, Methyl- propanediol, Fructooligosaccharides, Disodium Edta, Beta-Glucan, Hydrolyzed Hyaluronic Acid, Polyquaternium-51, Butylene Glycol, Hydroxy- propyltrimonium Hyaluronate, Dimethylsilanol Hyaluronate, Hydrolyzed Sodium Hyaluronate, Potassium Hyaluronate, Hyaluronic Acid, Sodium Hyaluronate Crosspolymer, Sodium Acetylated Hyaluronate, Sodium Hyaluronate Dimethyl- silanol, 1,2-Hexanediol, Hydroxyacetophenone, Ethylhexylglycerin",1193,114,0.0285,0.2018,0.4338,
original,A29.jpg,labelA29.txt,ok,"Aqua (Water), Caprylic/Capric Triglyceride, Cetyl Alcohol, Propanediol, Stearyl Alcohol, Glycerin, Sodium Hyaluronate, Arginine, Aspartic Acid, Glycine, Alanine, Serine, Valine, Isoleucine, Proline, Threonine, Histidine, Phenylalanine, Glucose, Maltose, Fructose, Trehalose, Sodium PCA, PCA, Sodium Lactate, Urea, Allantoin, Linoleic Acid, Oleic Acid, Phytosteryl Canola Glycerides, Palmitic Acid, Stearic Acid, Lecithin, Triolein, Tocopherol, Carbomer, Isoceteth-20, Polysorbate 60, Sodium Chloride, Citric Acid, Trisodium Ethylenediamine Disuccinate, Pentylene Glycol, Triethanolamine, Sodium Hydroxide, Phenoxyethanol, Chlorphenesin",  EGLYCERIDE CETYL ACDD  D  SADYNE PNEWAUNE SDLENE NEFEONESPEE PHEYLALNNINE CLUOOSE 818SE 9RC1SE TREA2S  SCTERELASO ACE LEAD 19STERCANOLA LYSDES PAMTAOD AADGTTLE  S9CETE020 P9LYSCA1:(88) DE TE RSDTPY_ENEDN E    C-10RENES,635,67,0.7307,0.9851,0.4324,
original,A3.jpg,labelA3.txt,ok,"Water, Glycerin, Dimethicone, Cetearyl Olivate, Avena Sativa (Oat) Kernel Flour, Sorbitan Olivate, Polyacrylamide, Synthetic Beeswax, Phenoxyethanol, C13-14 Isoparaffin, Butylene Glycol, Dimethicone Crosspolymer, Panthenol, Chlorphenesin, Dimethiconol, Carbomer, Laureth-7, Chrysanthemum Parthenium (Feverfew) Flower/Leaf/Stem Juice, Ethylhexylglycerin, Sodium Hydroxide, Avena Sativa (Oat) Kernel Extract, Centella Asiatica Extract","INGREDIENTS: Water, Glycerin, Dimethicone, Cetearyl Olivate, Avena Sativa (Oat) Kernel Flour, Šorbitan Olivate, Polyacrylamide, Synthetic Beeswax, Phenoxyethanol, C13-14 Isoparaffin, Butylene Glycol, Dimethicone Crosspolymer, Panthenol, Chlorphenesin, Dimethiconol, Carbomer, Laureth-7, Chrysanthemum Parthenium (Feverfew) Flower/Leaf/Stem Juice, Ethylhexylglycerin, Sodium Hydroxide, Avena Sativa (Öat) Kernel Extract, Centella Asiatica Extract",432,43,0.0347,0.0698,0.2383,
original,A30.jpg,labelA30.txt,ok,"Aqua, Glycerin, Myristyl Alcohol, Alcohol Denat., Myristyl Myristate, Cetearyl Glucoside, Coco-Caprylate/Caprate, Glyceryl Stearate, Palmitic Acid, Stearic Acid, Hydrogenated Coco-Glycerides, Simmondsia Chinensis Seed Oil, Tocopheryl Acetate, Prunus Amygdalus Dulcis Oil, Vegetable Oil, Cetyl Ricinoleate, Triisostearin, Sorbitan Stearate, Hydroxypropyl Starch Phosphate, Sodium Hydroxide, Cetearyl Alcohol, Gellan Gum, Xanthan Gum, Myristic Acid, Arachidic Acid, Oleic Acid, Lauric Acid, Disodium Cetearyl Sulfosuccinate, Phenoxyethanol, Parfum","Ingredients: Aqua, Glycerin, Myristyl Alcohol, Alcohol Denat., Myristyl Myristate, Cetearyl Glucoside, Cóco-Caprylate/Caprate, Glyceryl Stearate, Palmitic Acid, Stearic Acid, Hydrogenated Coco-Glycerides, Simmondsia Chinensis Seed Oil, Tocopheryl Acetate, Prunus Amygdalus Dulcis Óil, Vegetable Oil, Cetyl Ricinoleate, Triisostearin, Sorbitan Stearate, HydroxypropylStarch Phosphate,Sodium Hydroxide,CetearylAlcohol,Gellan Gum, Xanthan Gum, Myristic Acid, Arachidic Acid, Oleic Acid, Lauric Acid, Disodium Cetearyl Sulfosuccinate, Phenoxyethanol, Parfum",545,60,0.0367,0.1833,0.1963,
original,A31.jpg,labelA31.txt,ok,"Water/Eau, Glycerin, Isohexadecane, Niacinamide, Distarch Phosphate, Isopropyl Isostearate, Dimethicone, Panthenol, Palmitoyl Pentapeptide-4, Sodium Hyaluronate, Caprylic/Capric Triglyceride, Ethylhexylglycerin, Hydroxyacetophenone, Dimethiconol, Cetearyl Glucoside, Cetearyl Alcohol, Stearic Acid, Palmitic Acid, Stearyl Alcohol, Cetyl Alcohol, Behenyl Alcohol, Disodium EDTA, Sodium Acrylates Copolymer, PEG-100 Stearate, Titanium Dioxide, Mica, Phenoxyethanol, Fragrance/Parfum","INGREDIENTS/INGRÉDIENTS : WATER/EAU, GLYCERIN, ISOHEXADECANE, NIACINAMIDE*, DISTARCH PHOSPHATE, ISOPROPYL ISOSTEARATE, DIMETHICONE, PANTHENOL** PALMITOYL PENTAPEPTIDE-4***, SODIUM HYALURONATE, CAPRYLIC/CAPRIC TRIGLYCERIDE, ETHYLHEXYLGLYCERIN, HYDROXYACETOPHENONE, DIMETHICONOL, CETEARYL GLUCOSIDE, CETEARYL ALCOHOL, STEARIC ACID, PALMITIC ACID, STEARYL ALCOHOL, CETYL ALCOHOL, BEHENYL ALCOHOL, DISODIUM EDTA, SODIUM ACRYLATES COPOLYMER, PEG-100 STEARATE, TITANIUM DIOXIDE, MICA, PHENOXYETHANOL, FRAGRANCE/PARFUM *Vitamin/vitamine B3, **Pro-Vitamin/provitamine B5, ***Peptide",480,45,0.1979,0.2222,0.3255,
original,A32.jpg,labelA32.txt,ok,"Water/Aqua/Eau, Dimethicone, Butylene Glycol, Alcohol Denat., Betaine, Glycerin, Isohexadecane, Hydrogenated Polydecene, PPG-3 Dipivalate, Silica, Behenyl Alcohol, Stearyl Alcohol, Myristyl Myristate, Glyceryl Stearate SE, Polysorbate 60, PEG-100 Stearate, PEG/PPG-14/7 Dimethyl Ether, PEG/PPG-17/4 Dimethyl Ether, Phenoxyethanol, Dimethylacrylamide/Sodium Acryloyldimethyltaurate Crosspolymer, Titanium Dioxide (CI 77891), Sorbitan Tristearate, Erythritol, Fragrance (Parfum), Alcohol, Aminopropyl Dimethicone, 2-O-Ethyl Ascorbic Acid, Carbomer, Trisodium EDTA, Xanthan Gum, Caffeine, Potassium Hydroxide, Isostearic Acid, Sodium Metaphosphate, Phytosteryl/Octyldodecyl Lauroyl Glutamate, Aluminum Hydroxide, Linalool, Tocopherol, Sodium Metabisulfite, Limonene, Citrus Unshiu Peel Extract, Sodium Hyaluronate, Angelica Keiskei Leaf/Stem Extract, Ziziphus Jujuba Fruit Extract, Panax Ginseng Root Extract, Sodium Acetylated Hyaluronate, Scutellaria Baicalensis Root Extract, Iron Oxides (CI 77491), Alpinia Speciosa Leaf Extract, Rosmarinus Officinalis (Rosemary) Leaf Extract, Sanguisorba Officinalis Root Extract, Pyrola Incarnata Extract",INGREDIENTS: WATER(AQUA/EAU)·DIMETHICONE·BUTYLENE GLYCOL·ALCOHOL DENAT. BETAINE·GLYCERIN·ISOHEXADECANE·HYDROGENATED POLYDECENE·PPG-3 DIPIVALATE·SILICA·BEHENYLALCOHOL·STEARYLALCOHOL·MYRISTYL MYRISTATE·GLYCERYL STEARATE SE·POLYSORBATE 6O·PEG-10O STEARATE PEG/PPG-14/7 DIMETHYL ETHER·PEG/PPG-17/4 DIMETHYLETHER• PHENOXYETHANOL·DIMETHYLACRYLAMIDE/SODIUM ACRYLOYLDIMETHYLTAURATE CROSSPOLYMER·TITANIUM DIOXIDE (CI 77891) SORBITAN TRISTEARATE·ERYTHRITOL·FRAGRANCE (PARFUM)·ALCOHOL• AMINOPROPYL DIMETHICONE·2-O-ETHYLASCORBIC ACID·CARBOMER· TRISODIUM EDTA·XANTHAN GUM·CAFFEINE·POTASSIUM HYDROXIDE· ISOSTEARIC ACID·SODIUM METAPHOSPHATE·PHYTOSTERYL/OCTYLDODECYL LAUROYL GLUTAMATE·ALUMINUM HYDROXIDE·LINALOOL·TOCOPHEROL• SODIUM METABISULFITE·LIMONENE·CITRUS UNSHIU PEEL EXTRACT·SODIUM HYALURONATE·ANGELICA KEISKEI LEAF/STEM EXTRACT·ZIZIPHUS JUJUBA FRUIT EXTRACT ·PANAX GINSENG ROOT EXTRACT·SODIUM ACETYLATED HYALURONATE SCUTELLARIA BAICALENSIS ROOT EXTRACT · IRON OXIDES (CI 77491) - ALPINIA SPECIOSA LEAF EXTRACT · ROSMARINUS OFFICINALIS (ROSEMARY) LEAF EXTRACT (ROSMARINUS OFFICINALIS LEAF EXTRACT) · SANGUISORBA OFFICINALIS ROOT EXTRACT·PYROLAINCARNATA EXTRACT·<M098514-702>,1141,119,0.1455,0.7563,0.6349,
original,A33.jpg,labelA33.txt,ok,"Water, Dimethicone, Glycerin, Butylene Glycol, Ammonium Acryloyldimethyltaurate/VP Copolymer, Niacinamide, Linoleamidopropyl PG-Dimonium Chloride Phosphate, Phenoxyethanol, Ammonium Acryloyldimethyltaurate/Beheneth-25 Methacrylate Crosspolymer, Dimethicone, Perfume, Sodium PCA, Disodium EDTA, Stearic Acid, Caprylic/Capric Triglyceride, Tocopheryl Acetate, Triethanolamine, BHT, Iodopropynyl Butylcarbamate, Sodium Hyaluronate Crosspolymer, Sodium Hyaluronate, Sodium Acetylated Hyaluronate, Hydrolyzed Hyaluronic Acid, Pentylene Glycol, Ethylhexylglycerin, Aqua, Citral, Citronellol, Geraniol, Hexyl Cinnamal, Limonene, Linalool, CI 42090",,640,58,1.0,1.0,0.0409,
original,A5.jpg,labelA5.txt,ok,"Aqua/Water/Eau, Dimethicone, Propanediol, Butylene Glycol, Niacinamide, Nylon-12, Acrylates Crosspolymer, Sodium Hyaluronate, Enantia Chlorantha Bark Extract, Avena Sativa (Oat) Kernel Extract, Camellia Sinensis Leaf Extract, Chrysanthemum Parthenium (Feverfew) Extract, Glycyrrhiza Glabra (Licorice) Root Extract, Glycerin, Oleanolic Acid, Sorbitan Isostearate, Caprylyl Glycol, Glyceryl Stearate Citrate, Hydrogenated Polydecene, Hydroxyethyl Acrylate/Sodium Acryloyldimethyl Taurate Copolymer, 1,2-Hexanediol, Lecithin, Polysilicone-11, Polysorbate 60, Sodium Acrylate/Sodium Acryloyldimethyl Taurate Copolymer, Sodium Acrylates Copolymer, Laureth-8, Citric Acid, Phenoxyethanol, Potassium Sorbate, Sodium Benzoate",,717,71,1.0,1.0,0.0433,
