dataset,image_file,label_file,status,reference_text,ocr_text_raw,ocr_text_fuzzy,ref_chars,ref_words,cer_raw,wer_raw,cer_fuzzy,wer_fuzzy,ocr_time_sec,error
original,x111.jpg,labelx111.txt,ok,"Deionized Water, Isododecane, Niacinamide, Propanediol, Polyglyceryl-2 Stearate, Dimethicone, Sodium Hyaluronate Crosspolymer, Triethanolamine, Butylene Glycol, 2-Phenoxyethanol, Carbomer, PEG-40 Hydrogenated Castor Oil, Trideceth-9, Allantoin, Perfume, Chlorphenesin, Glycerine, Centella Asiatica Extract, Hydrolyzed Sodium Hyaluronate, Sodium Hyaluronate, Magnesium Ascorbyl Phosphate, Hydrolyzed Algin, Disodium EDTA, Propylene Glycol, Polygonum Cuspidatum Root Extract, Scutellaria Baicalensis Root Extract, Camellia Sinensis Leaf Extract, Glycyrrhiza Glabra Root Extract, Xanthan Gum, Chamomilla Recutita Flower Extract, Rosmarinus Officinalis Leaf Extract, Atelocollagen, Sodium Chondroitin Sulfate, Polysorbate 20, Saccharide Isomerate, Lecithin, Hexanoyl Dipeptide-3 Norleucine Acetate","DIMETHICONE, SODIUM HYALURONATE CROSSPOLYMER, GLYCERYL STEARATE, STEARYL ALCOHOL, TRIETHANOLAMINE, BUTYLENE GLYCOL, 2-PHENOXYETHANOL, CARBOMER, PEG-40 HYDROGENATED CASTOR OIL, TRIDECETH-9, ALLANTOIN, PERFUME, CHLORPHENESIN, GLYCERINE, CENTELLA ASIATICA EXTRACT, HYDROLYZED SODIUMHYALURONATE,SODIUMHYALURONATE, MAGNESIUM ASCORBYLPHOSPHATE,HYDROLYZED ALGIN, DISODIUM EDTA, PROPYLENE GLYCOL, POLYGONUM CUSPIDATUM ROOT EXTRACT, SCUTELLARIA BAICALENSIS ROOT EXTRACT, CAMELLIA SINENSIS LEAF EXTRACT, GLYCYRRHIZA GLABRA ROOT EXTRACT, XANTHAN GUM, CHAMOMILLA RECUTITA FLOWER EXTRACT, ROSMARINUS OFFICINALIS LEAF EXTRACT, ATELOCOLLAGEN, SODIUM CHONDROITIN SULFATE, POLYSORBATE 20, SACCHARIDE ISOMERATE, LECITHIN. HEXANOYL DIPEPTIDE-3 NORLEUCINE ACETATE ā-oo=","DIMETHICONE, SODIUM HYALURONATE CROSSPOLYMER, GLYCERYL STEARATE, STEARYL ALCOHOL, TRIETHANOLAMINE, BUTYLENE GLYCOL, 2-PHENOXYETHANOL, CARBOMER, PEG-40 HYDROGENATED CASTOR, OIL, TRIDECETH-9, ALLANTOIN, PERFUME, CHLORPHENESIN, GLYCERINE, CENTELLA ASIATICA ROOT EXTRACT, HYDROLYZED SODIUM HYALURONATE, SODIUM HYALURONATE, MAGNESIUM ASCORBYL PHOSPHATE, HYDROLYZED, ALGIN, DISODIUM EDTA, PROPYLENE GLYCOL, POLYGONUM CUSPIDATUM ROOT EXTRACT, SCUTELLARIA, BAICALENSIS ROOT EXTRACT, CAMELLIA SINENSIS LEAF CELL EXTRACT, GLYCYRRHIZA GLABRA ROOT EXTRACT, XANTHAN GUM, CHAMOMILLA RECUTITA FLOWER EXTRACT, ROSMARINUS OFFICINALIS LEAF EXTRACT, ATELOCOLLAGEN, SODIUM CHONDROITIN SULFATE, POLYSORBATE 20, SACCHARIDE ISOMERATE, LECITHIN, HEXANOYL DIPEPTIDE-3 NORLEUCINE ACETATE, ā-oo=",793,81,0.1173,0.2346,0.1274,0.2099,68.8659,
original,x112.jpg,labelx112.txt,ok,"Aqua, Niacinamide, Glycerin, Propylene Glycol, Phenoxyethanol, Aloe Barbadensis Leaf Juice Powder, Carbomer, Triethanolamine, Chlorphenesin, Allantoin, Disodium EDTA, Polysorbate 20, Mannitol, Xanthan Gum, Cellulose, Tetrahydrodiferuloylmethane, Fragrance, Alpha-Arbutin, Dipotassium Glycyrrhizate, CI 77492, Tocopherol, Glutathione, Hydroxypropyl Methylcellulose, Sodium Glycyrrhizate, Citrus Sinensis Leaf Extract, Citrus Aurantium Dulcis Fruit Extract, CI 19140, Citrus Limon Fruit Extract, Pyrus Malus Fruit Extract, Saccharum Officinarum Extract, Menthol, Methyl Ubiquinone, Ethyl Menthane Carboxamide, Hydroxypropylcellulose, CI 42090, Acrylates Copolymer, Oligopeptide-1",BLMNOCM CM em4AOnu vrr0-61037 Ln,"BLMNOCM CM, em4AOnu, vrr0-61037, Ln",677,70,0.9616,1.0,0.9572,1.0,48.2292,
original,x113.jpg,labelx113.txt,ok,"Aqua (Water), Ethylhexyl Methoxycinnamate, Niacinamide, Isododecane, Neopentyl Glycol Diheptanoate, Methylene Bis-Benzotriazolyl Tetramethylbutylphenol (Nano), Propylene Glycol, Potassium Cetyl Phosphate, Benzophenone-3, Octocrylene, Butyl Methoxydibenzoylmethane, Triethanolamine, Glycerin, Isoamyl p-Methoxycinnamate, Bakuchiol, Decyl Glucoside, Chlorphenesin, Acrylates/C10-30 Alkyl Acrylate Crosspolymer, Triethylene Glycol, Disodium EDTA, Xanthan Gum, Tocopheryl Acetate, 1,2-Hexanediol, Biosaccharide Gum-4, Caprylyl Glycol, Glucose, Sodium Hyaluronate, Chondrus Crispus Extract, Hydroxypropyltrimonium Hyaluronate, Sodium Acetylated Hyaluronate, Hydrolyzed Hyaluronic Acid, Hyaluronic Acid, Sodium Hyaluronate Crosspolymer, Hydrolyzed Sodium Hyaluronate, Potassium Hyaluronate, Phenoxyethanol, Cetearyl Alcohol, Butylene Glycol","Neopenty Glycol Diheptanoate, Methylene Bis-Benzotriazolyl Tetramethylbutyiphenol (Nano), Propylene Glycol, Potassium Cetyl Phosphate, Benzophenone-3, Octocrylene, Butyl Methoxydibenzoylmethane, Triethanolamine, Glycerin, Isoamyl p-Methoxycinnamate, Bakuchiol, Decyl Glucoside, Chlorphenesin, Acrylates/C10-30 Alkyl Acrylate Crosspolymer, Triethylene Glycol, Disodium EDTA, Xanthan Gum, Tocophery Acetate, 1,2-Hexanediol, Biosaccharide Gum-4, Caprylyl Glycol, Glucose, Sodium Hyaluronate, Chondrus Crispus Extract, Hydroxypropyltrimonium Hyaluronate, Sodium Acetylated Hyaluronate, Hydrolyzed Hyaluronic Acid, Hyaluronic Acid, Sodium Hyaluronate Crosspolymer, Hydrolyzed Sodium fioou:","Neopenty Glycol Diheptanoate, Methylene Bis-Benzotriazolyl Tetramethylbutylphenol (Nano), Propylene, Glycol, Potassium Cetyl Phosphate, Benzophenone-3, Octocrylene, Butyl Methoxydibenzoylmethane, Triethanolamine, Glycerin, Isoamyl p-Methoxycinnamate, Bakuchiol, Decyl Glucoside, Chlorphenesin, Acrylates/C10-30 Alkyl Acrylate Crosspolymer, Triethylene Glycol, Disodium EDTA, Xanthan Gum, Tocophery Acetate, 1,2-Hexanediol, Biosaccharide Gum-4, Caprylyl Glycol, Glucose, Sodium Hyaluronate, Chondrus Crispus Extract, Hydroxypropyltrimonium Hyaluronate, Sodium Acetylated Hyaluronate, Hydrolyzed Hyaluronic Acid, Hyaluronic Acid, Sodium Hyaluronate Crosspolymer, Hydrolyzed Sodium, fioou",834,76,0.1835,0.2237,0.1823,0.2368,60.6991,
original,x114.jpg,labelx114.txt,ok,"Aqua, Arbutin, Butylene Glycol, Raphanus Sativus Root Extract, Phenoxyethanol, Tocopherol, C13-14 Isoparaffin, Chlorphenesin, Allantoin, Ascorbyl Tetraisopalmitate, C9-11 Pareth-6, Fragrance, Disodium EDTA, Sodium Hyaluronate, Propylene Glycol, Collagen, Ubidecarenone, Polyacrylamide","zhauoaa dbuus:nou/Ingredients: Aqua, Arbutin, Butylene Glycol, Raphanus Sativus Root Extract, Phenoxyethanol, Tocopherol, C13-14 isoparaffin, Chlorphenesin, Allantoin, Ascorbyl Tetraisopalmitate, C9-11 Pareth- Hyaluronate, Fragrance, Disodium EDTA Sodium Propylene Glycol, Collagen, Ubidecarenone, Polyacrylamide","zhauoaa, dbuus, nou/Ingredients, Aqua, Arbutin, Butylene, Glycol, Raphanus, Sativus, Root, Extract, Phenoxyethanol, Tocopherol, C13-14 isoparaffin, Chlorphenesin, Allantoin, Ascorbyl, Tetraisopalmitate, C9-11 Pareth, Hyaluronate, Fragrance, Disodium, EDTA, Sodium, Propylene, Glycol, Collagen, Ubidecarenone, Polyacrylamide",284,28,0.2007,0.2143,0.2289,0.5,47.659,
original,x115.jpg,labelx115.txt,ok,"WATER, ETHYLHEXYL METHOXYCINNAMATE, ETHYLHEXYL SALICYLATE, BIS-ETHYLHEXYLOXYPHENOL METHOXYPHENYL TRIAZINE, CYCLOPENTASILOXANE, PROPANEDIOL, TETRAMETHYLBUTYLPHENOL (NANO), BUTYLOCTYL SALICYLATE, METHYLENE BIS-BENZOTRIAZOLYL TETRAMETHYLBUTYLPHENOL, DISODIUM EDTA, TITANIUM DIOXIDE, CAPRYLYL GLYCOL, GLYCERYL STEARATE, SALIX ALBA BARK EXTRACT, POLYMETHYLSILSESQUIOXANE, PEG-9 STEARATE, DIMETHICONE, CETEARYL ALCOHOL, ALLANTOIN, PROPYLENE GLYCOL, ADENOSINE, DECYL GLUCOSIDE, ETHYLHEXYLGLYCERIN, 1,2-HEXANEDIOL, SODIUM LAUROYL LACTYLATE, XANTHAN GUM, CURCUMA AROMATICA ROOT EXTRACT, CENTELLA ASIATICA LEAF EXTRACT, SILICA, ZINGIBER MONTANUM (GINGER) RHIZOME EXTRACT, CHLORPHENESIN","SOUnoUy/INGREDIENTS: WATER ETHYLHEXYL METHCAYCINNAMATE, ETHYLHEXYL SALICYLATE BIS-ETHYLHEXYLOIYPHENOL METHOXYPHENYL TRIAZINE CYCLOPENTASILOXANE PROPANEDIOL METHYLENE BIS-BENZOTRIAZOLYL TETRAMETHYLBUTYUPHENOL (NANCL BUTYLOCTYL SAUCYLATE BUTYLENE GLYCOL CETYLALCOHOL GLYCERYL STEARATIE METHYL METHACRYLATE CROSSPOLYMER SALIX ALBA BARK EXTRACT, POLYMETHYLSLSESQUICKANE, PEG- STEARATE, DIMETHICONE CETEARETH-IAL DECYL GLUCOSIDE ALLANTOIN, PROPYLENE GLYCOL ACRLATES/C10-30 ALKYL ACRYLATE CROSSPOLYMER ETHYLHEXYLGLYCERIN, DISODIUM EDTA, 1.2-HEXANEDIOL SODIUM LAUROYL LACTYLATIE TOCOPHERYL ACETATE, SCDILIM HYDRCKIDE, CENTELLA ASIATICA LEAF EXTRACT, XANTHAN GUM, CURCUMA AROMATICA ROOT EXTRACT. CURCUMA LONGA (TURMERICI EXTRACT, CERAMIDE NP. CERAMIDE AP, CHOLESTEROL, PHYTOSPHINGOSINE, CARBOMER, CENTELLA ASIATICA EXTRACT, SIUCA ZINGBER MONTANUM EXTRACT, PHENOKYETHANOL CAESALPINA SPINOSA FRLIT POD EXTRACT SCOIUM DNA, HELIANTHUS ANNUUS SPROUT EXTRACT, SODIUM BENZCATE, CERAMIDE EOP. CENTELLA ASIATICA LEAFVESICLES","WATER ETHYLHEXYL METHCAYCINNAMATE, ETHYLHEXYL SALICYLATE BIS-ETHYLHEXYLOIYPHENOL, METHOXYPHENYL TRIAZINE CYCLOPENTASILOXANE PROPANEDIOL METHYLENE BIS-BENZOTRIAZOLYL, TETRAMETHYLBUTYUPHENOL (NANCL BUTYLOCTYL SAUCYLATE BUTYLENE GLYCOL CETYLALCOHOL, GLYCERYL STEARATIE METHYL METHACRYLATE CROSSPOLYMER SALIX ALBA BARK EXTRACT, POLYMETHYLSLSESQUICKANE, PEG-20 STEARATE, DIMETHICONE CETEARETH-IAL DECYL GLUCOSIDE, ALLANTOIN, PROPYLENE GLYCOL ACRLATES/C10-30 ALKYL ACRYLATE CROSSPOLYMER, ETHYLHEXYLGLYCERIN, DISODIUM EDTA, 1.2-HEXANEDIOL SODIUM LAUROYL LACTYLATIE, TOCOPHERYL ACETATE, SCDILIM HYDRCKIDE, CENTELLA ASIATICA LEAF CELL EXTRACT, XANTHAN GUM, CURCUMA AROMATICA ROOT EXTRACT. CURCUMA LONGA (TURMERICI EXTRACT, CERAMIDE NG, CERAMIDE AP, CHOLESTEROL, PHYTOSPHINGOSINE, CARBOMER, CENTELLA ASIATICA ROOT EXTRACT, SIUCA ZINGBER MONTANUM EXTRACT, PHENOKYETHANOL CAESALPINA SPINOSA FRLIT POD EXTRACT, SCOIUM DNA, HELIANTHUS ANNUUS SPROUT EXTRACT, SODIUM BENZCATE, CERAMIDE EOP, CENTELLA ASIATICA LEAFVESICLES",675,63,0.8044,1.254,0.7896,1.254,59.6242,
original,x116.jpg,labelx116.txt,ok,"Water, Niacinamide, Rosa Damascena Flower Water, Glycerin, Propylene Glycol, Trehalose, Phenoxyethanol, Avena Sativa Bran Extract, Carbomer, Triethanolamine, Butylene Glycol, Allantoin, Disodium EDTA, Titanium Dioxide, Caprylyl Glycol, Tetrahydroxypropyl Ethylenediamine, PEG-40 Hydrogenated Castor Oil, Xanthan Gum, 1,2-Hexanediol, Melissa Officinalis Extract, Pentylene Glycol, Citrus Reticulata Peel Extract, Hydroxyethyl Phosphatidylcholine, Sodium Hyaluronate, Hydrolyzed Hyaluronic Acid, Squalane, Cetyl Alcohol, Ethyl Linoleate, Ziziphus Spina-Christi Leaf Extract, Coco-Glucoside, Hesperidin, Citric Acid, Ceramide NP, Sodium Benzoate, Glycosaminoglycans, Nicotiana Benthamiana Hexapeptide-40, Polypeptide-17","00 Butylene Gycol, Allantoin, Water, Glycarin, Bran Propylene Glyool, Disodiurn EDTA, Titanium Dioxide, Caprylyl Extract, Carbomer, Trethanolamine, Tetrahydrocurcumin, Propanodiol, Xanthan Gum, 1,2-Hexanediol, Melissa Glycol, Chlorphenesin, Phosphatidylcholine. Squalene, Glycol 400. Ceramide NP, Sodium Polypeptide-47 Benzoate.","00, Butylene Gycol, Allantoin, Water, Glycarin, Bran, Propylene, Glyool, Disodiurn EDTA, Titanium Dioxide, Caprylyl, Extract, Carbomer, Triethanolamine, Tetrahydrocurcumin, Propanodiol, Xanthan Gum, 1,2-Hexanediol, Melissa, Glycol, Chlorphenesin, Phosphatidylcholine, Squalene, Glycol 400, Ceramide NP, Sodium, Polypeptide-47, Benzoate",716,73,0.6732,0.8082,0.6662,0.8493,61.9052,
original,x117.jpg,labelx117.txt,ok,"Aqua, Propanediol, Niacinamide, Glycerin, Caprylic/Capric Triglyceride, Butylene Glycol, Panthenol, Phenoxyethanol, Sodium Polyacryloyldimethyl Taurate, Saccharide Isomerate, Arginine, Carbomer, Isohexadecane, Bisabolol, Xylitylglucoside, Dendrobium Officinale Stem Extract, Sparassis Crispa Extract, Anhydroxylitol, Polysorbate 20, Ethylhexylglycerin, Pentylene Glycol, Hamamelis Virginiana Water, 1,2-Hexanediol, Nymphaea Chalong Kwan Flower Extract, Maltodextrin, PEG-7 Glyceryl Cocoate, Xylitol, Disodium EDTA, Glycerol, Polyquaternium-51, Aloe Barbadensis Leaf Juice, Glucose, Laminaria Digitata Extract, Dipotassium Glycyrrhizate, Sodium Hyaluronate, Hydrogenated Lecithin, Opuntia Ficus-Indica Stem Extract, Asiaticoside, Madecassic Acid, Asiatic Acid, Glycine, Citric Acid, Sodium Citrate, Serine, Glutamic Acid, Cetyl-PG Hydroxyethyl Palmitamide, Ceramide EOP, Ceramide NG, Ceramide NP, Ceramide AS, Ceramide AP, Cholesterol, Aspartic Acid, Leucine, Sodium DNA, Centella Asiatica Extract, Sodium Benzoate, Alanine, Lysine, Tyrosine, Phenylalanine, Threonine, Proline, Valine, Benzoic Acid, Isoleucine, Histidine","Aqua, Propanediol, Niedinamide, Glycerin, Caprytic/Capric Trigtyceride, Butylene Glycol Panthenol, Phenoxyethanol, Sodium Polyacryloyidimethyl Taurate, Saccharide Isomerate, Arginine, Carbomer, Isohexadecane, Bisabolol, Xylitylglucoside, Dendrobium Officinale Stem Extract, Sparassis Crispa Extract, Anhydroxylitol, Polysorbate 20, Ethylhexylgtycerin, Pentylene Glycol, Hamamelis Virginiana Water, 1,2-Hexanediol, Nympheea Chalong Kwan Flower Extract, Maltodextrin, PEG-7 Glyceryl Cocoate, Xylitol, Disodium EDTA, Glycerol, Polyquaternium-51, Aloe Barbadensis Leaf Juice, Glucose, Laminaria Digitata Extract, Dipotassium Glycyrrhizinate, Sodium Hyaluronate, Hydrogenated Lecthin, Opuntia Ficus-Indica Stem Extract, Aslaticoside, Madecassic Acid, Asiatic Acid, Glycine, Citric Acid, Sodium Citrate, Serine, Glutamic Acid, Cetyl-PG Hydroxyethyl Palmitamide, Ceramide EOP, Ceramide NG, Ceramide NP, Ceramide AS, Ceramide AP, Cholesterol, Aspartic Acid, Leucine, Sodium DNA, Centella Asiatica Extract, Sodium Benzoate, Alanine, Lysine, Tyrosine, Phenylalanine, Threonine, Proline, Valine, Benzoic Acid, Isoleucine, Histidine - 53 17","Aqua, Propanediol, Niedinamide, Glycerin, Caprylic/Capric Triglyceride, Butylene Glycol, Panthenol, Phenoxyethanol, Sodium Polyacryloyidimethyl Taurate, Saccharide Isomerate, Arginine, Carbomer, Isohexadecane, Bisabolol, Xylitylglucoside, Dendrobium Officinale Stem Extract, Sparassis Crispa Extract, Anhydroxylitol, Polysorbate 20, Ethylhexylglycerin, Pentylene Glycol, Hamamelis Virginiana Water, 1,2-Hexanediol, Nympheea Chalong Kwan Flower Extract, Maltodextrin, PEG-7 Glyceryl Cocoate, Xylitol, Disodium EDTA, Glycerol, Polyquaternium-51, Aloe Barbadensis Leaf Juice, Glucose, Laminaria Digitata Extract, Dipotassium Glycyrrhizinate, Sodium Hyaluronate, Hydrogenated Lecithin, Opuntia Ficus-Indica Stem Extract, Asiaticoside, Madecassic Acid, Asiatic Acid, Glycine, Citric Acid, Sodium Citrate, Serine, Glutamic Acid, Cetyl-PG Hydroxyethyl Palmitamide, Ceramide EOP, Ceramide NP, Ceramide NP, Ceramide AS, Ceramide AP, Cholesterol, Aspartic Acid, Leucine, Sodium DNA, Centella Asiatica Extract, Sodium Benzoate, Alanine, Lysine, Tyrosine, Phenylalanine, Threonine, Proline, Valine, Benzoic Acid, Isoleucine, Histidine, 53 17",1120,117,0.0179,0.1111,0.0125,0.0684,58.2036,
original,x118.jpg,labelx118.txt,ok,"Water, Glycerin, Dimethicone, Butylene Glycol, Dipropylene Glycol, Phenoxyethanol, Saccharide Isomerate, Niacinamide, Carbomer, Chlorphenesin, Disodium EDTA, Panthenol, PPG-5-Deceth-30, Potassium Hydroxide, Xanthan Gum, PEG-14M, Sodium Hyaluronate, Fragrance, 3-O-Ethyl Ascorbic Acid, Aloe Barbadensis Leaf Juice, Maltodextrin, Citric Acid, Sodium Citrate, Prunus Yedoensis Leaf Extract, Hydrolyzed Collagen, 1,2-Hexanediol, Terminalia Ferdinandiana Fruit Extract, Cystoseira Tamariscifolia Extract, Potassium Sorbate, Sodium Benzoate, Caprylyl Glycol, Citrus Junos Fruit Extract, Cynara Scolymus (Artichoke) Leaf Extract, Citrus Aurantium Bergamia (Bergamot) Fruit Extract, Hibiscus Esculentus Fruit Extract, Houttuynia Cordata Extract, Hyaluronic Acid, Hydrolyzed Sodium Hyaluronate, Hydroxypropyltrisilamine Hyaluronate, Oenothera Biennis (Evening Primrose) Seed Extract, Pullulan, Angelica Gigas Root Extract, Aralia Continentalis Root Extract, Pueraria Lobata Root Extract, Potassium Hyaluronate, Prunus Persica (Peach) Leaf Extract, Retinyl Palmitate, Phyllostachys Bambusoides Leaf/Stem Extract, Asparagus Officinalis Stem Extract, Artemisia Princeps Leaf Extract, Sodium Acetylated Hyaluronate, Sodium Hyaluronate Crosspolymer","abuus:nau/Ingredients: SACCHARIDE ISOMERATE, HACINAVIDE, CARBOMER CHLORPHENESIN, DSOOIUM EDTA PANTHENOL PPG-6-DECYLTETRADECETH-30, POTASSIUM HYDRODXIDE, XANTHAN GUM, PEG-14M, SODIUM HYALURONATE, FRAGRANCE, 3-O-ETHY. ASOORBIC ACID, ALOE BARBADENSIS LEAF JUICE, COLLAGEN, 1,2-HEXANEDIOL TERMINALUA FERDINANDIAHA FRUIT EXTRACT, CYSTOSEITA TAARSOFOLUA EXTRACT, POTASSILIM SORBATE, SODIUM BBNZOATE CAPRYIDL GLYCOL PANCRATIUM MARITIMUM EXTRACT, AUGAE EXTRACT, CHONDRUS CRISPUS EXTRACT, CITRUS JUNOS FRUIT EXTRACT CYNARA SOOLYMUS IAHTICHOKE LEAF EXTRACT, GLUODSE HEIBOUS ESCULDNTUS FRUIT EXTRACT, HOUFTUYNA COFDATA EXTRACT HURLURONIC ACDHYDHOLYZED 2 HYALURONIC ACID, HYDROLYZED SODUM HYALURONATE HYDNOXYPROPYDURIMONUM E HYALURONATE OENOTHERA BIENNS (EVDNING PRMHOGED BEED ETRACT, PHELLODENDRON AMURENSE BARKEXTRACT, POTASSIUMHYALURONATE PRUNUS PERSICAPEADHALEAF SODUMHYALURONATE CRDSSPOLYMER","abuus, nau/Ingredients, SACCHARIDE ISOMERATE, HACINAVIDE, CARBOMER CHLORPHENESIN, DSOOIUM EDTA PANTHENOL, PPG-6-DECYLTETRADECETH-30, POTASSIUM HYDRODXIDE, XANTHAN GUM, PEG-14M, SODIUM, HYALURONATE, FRAGRANCE, 3-O-ETHY. ASOORBIC ACID, ALOE BARBADENSIS LEAF JUICE, COLLAGEN, 1,2-HEXANEDIOL TERMINALUA FERDINANDIAHA FRUIT EXTRACT, CYSTOSEITA, TAARSOFOLUA EXTRACT, POTASSILIM SORBATE, SODIUM BBNZOATE CAPRYIDL GLYCOL, PANCRATIUM MARITIMUM EXTRACT, AUGAE EXTRACT, CHONDRUS CRISPUS EXTRACT, CITRUS, JUNOS FRUIT EXTRACT CYNARA SOOLYMUS IAHTICHOKE LEAF EXTRACT, GLUODSE HEIBOUS, ESCULDNTUS FRUIT EXTRACT, HOUFTUYNA COFDATA EXTRACT HURLURONIC ACDHYDHOLYZED, 2, HYALURONIC ACID, HYDROLYZED SODUM HYALURONATE HYDNOXYPROPYDURIMONUM, E, HYALURONATE OENOTHERA BIENNS (EVDNING PRMHOGED BEED ETRACT, PHELLODENDRON, AMURENSE BARKEXTRACT, POTASSIUMHYALURONATE PRUNUS PERSICAPEADHALEAF, SODIUM HYALURONATE CROSSPOLYMER",1234,132,0.4919,0.7803,0.4895,0.7652,53.2085,
original,x119.jpg,labelx119.txt,ok,"Aqua, Propanediol, Niacinamide, Carbomer, Triethanolamine, Butylene Glycol, Dipotassium Glycyrrhizate, Glycerin, Aloe Barbadensis Leaf Extract, Glycolic Acid, Mannitol, Allantoin, Alpha-Arbutin, Disodium EDTA, Sodium Tripolyphosphate, Saccharum Officinarum Extract, Dimocarpus Longan Fruit Extract, Cellulose, Honey Extract, Yeast Ferment Extract, 1,2-Hexanediol, Caprylyl 2-Glyceryl Ascorbate, Collagen, Propylene Glycol, Citrus Limon Fruit Extract, Cucumis Sativus Fruit Extract, Decyl Glucoside, Glyceryl Stearate Citrate, Hydrogenated Castor Oil, Maltodextrin, Camellia Sinensis Leaf Extract, Citrus Aurantium Dulcis Fruit Extract, Pyrus Malus Fruit Extract, Tranexamic Acid, Hydroxypropyl Methylcellulose, Phenoxyethanol, Chlorphenesin, CI 77891, Fragrance","BUTYLENE GLYCOL, DIPOTASSIUM GLYCYRRHIZATE, GLYCERIN, ALOE BARBADENSIS LEAFEXTRACT, GLYCOLICACID,MANNITOL,ALLANTOINALPHA-ARBUTIN,DISODIUMEDTASODIUMTRIPOLYPHOSPHATE, SACCHARUM OFFICNARUM EXTRACT, DIMOCARPUS LONGAN FRUIT EXTRACT,CELLULOSE, HONEY EXTRACT,YEASTFERMENTEXTRACT,12-HEXANEDIOL,CAPRYLYL2-GLYCERYLASCORBATE,COLLAGEN PROPYLENE GLYCOL, CITRUS LIMON FRUIT EXTRACT, CUCUMIS SATIVUS FRUIT EXTRACT, DECYL CHLORPHENESIN, CT7891, FRAGRANCE","BUTYLENE GLYCOL, DIPOTASSIUM GLYCYRRHIZATE, GLYCERIN, ALOE BARBADENSIS LEAFEXTRACT, GLYCOLICACID, MANNITOL, ALLANTOINALPHA-ARBUTIN, DISODIUMEDTASODIUMTRIPOLYPHOSPHATE, SACCHARUM OFFICNARUM EXTRACT, DIMOCARPUS LONGAN FRUIT EXTRACT, CELLULOSE, HONEY, EXTRACT, YEASTFERMENTEXTRACT,12-HEXANEDIOL, CAPRYLYL 2-GLYCERYL ASCORBATE, COLLAGEN, PROPYLENE GLYCOL, CITRUS LIMON FRUIT EXTRACT, CUCUMIS SATIVUS FRUIT EXTRACT, DECYL, CHLORPHENESIN, CT7891, FRAGRANCE",761,82,0.4258,0.6829,0.4126,0.6098,47.1555,
original,x12.jpg,labelx12.txt,ok,"Water, Isononyl Isononanoate, Glycerin, Niacinamide, Hydrogenated Polydecene, Propanediol, Sodium Acrylates Copolymer, Xylitylglucoside, Butylene Glycol, Cetearyl Alcohol, Anhydroxylitol, Phenoxyethanol, Glyceryl Stearate, Butyrospermum Parkii (Shea) Butter, Lecithin, PEG-100 Stearate, Xylitol, Chlorphenesin, Glucose, Disodium EDTA, Tocopheryl Acetate, Sodium Hyaluronate, Aloe Barbadensis Leaf Juice, Hydrolyzed Hyaluronic Acid, Maltodextrin, Alteromonas Ferment Extract, Potassium Sorbate","Glycol, Parkil EDTA. Hyaluron Maltodextrin, Alteromonas Ferment Extract, Potasslum Sorbate. Sodium ate. 517","Glycol, Parkil, EDTA, Hyaluron, Maltodextrin, Alteromonas Ferment Extract, Potassium Sorbate, Sodium, ate, 517",492,49,0.8455,0.9592,0.8313,0.9184,42.9563,
original,x120.jpg,labelx120.txt,ok,"Water, Niacinamide, Butylene Glycol, Glycerin, Betaine, Phenoxyethanol, Panthenol, Polysorbate 20, Carbomer, Xanthan Gum, Polyquaternium-7, Methylsilanol Mannuronate, Centella Asiatica Leaf Vesicles, Centella Asiatica Leaf Extract, 1,2-Hexanediol, Ethylhexylglycerin, Saccharide Isomerate, Ubiquinone, Caprylic/Capric Triglyceride, Olea Europaea (Olive) Fruit Oil, Hydrogenated Lecithin, Butyrospermum Parkii (Shea) Butter, Cholesterol, Ceramide NP, Phytosphingosine, Fragrance, Aloe Vera Vesicles, Sodium Hyaluronate, Potassium Hydroxide","douus:nou (Ingredients) : Water, Niacinamide, Butylene Glycol, Glycerin, Betaine, PhenoxyethanolPanthenol, Polysorbate 20, Carbomer, Xanthan Gum, Polyquaternium-7, Methylsilanol Mannuronate, Centella Asiatica Leaf Vesicies, Centella Asiatica Leaf Extract, 1,2-Hexanediol, Ethylhexyiglycerin, Saccharide Isomerate, Ubiquinone, Caprylic/Capric Triglyceride, Olea Europaea (Olive) Fruit Oil, Hydrogenated Lecithin, Butyrospermum Parkll (Shea) Butter, Chciasterol, Ceramide NP, Phytosphingosine, Fragrance, Aloe Vera Vesicies, Sodium Hyaluronate, Potassium Hydroxide","douus, nou (Ingredients), Water, Niacinamide, Butylene Glycol, Glycerin, Betaine, PhenoxyethanolPanthenol, Polysorbate 20, Carbomer, Xanthan Gum, Polyquaternium-7, Methylsilanol Mannuronate, Centella Asiatica Leaf Vesicies, Centella Asiatica Leaf Extract, 1,2-Hexanediol, Ethylhexylglycerin, Saccharide, Isomerate, Ubiquinone, Caprylic/Capric Triglyceride, Olea Europaea (Olive) Fruit Oil, Hydrogenated Lecithin, Butyrospermum Parkii (Shea) Butter, Chciasterol, Ceramide NP, Phytosphingosine, Fragrance, Aloe Vera Vesicies, Sodium Hyaluronate, Potassium Hydroxide",538,54,0.0669,0.1852,0.0632,0.1667,56.8646,
original,x121.jpg,labelx121.txt,ok,"Aqua (Water), Octoxynol, Homosalate, Butyl Methoxydibenzoylmethane, Ethylhexyl Salicylate, Propylene Glycol, C12-15 Alkyl Benzoate, Potassium Cetyl Phosphate, Phenoxyethanol, Xanthan Gum, Chlorphenesin, Acrylates/C10-30 Alkyl Acrylate Crosspolymer, Silica Dimethyl Silylate, Titanium Dioxide, Disodium EDTA, Sodium Stearoyl Glutamate, Tocopheryl Acetate, Carbomer, Sodium Hydroxide, Parfum (Fragrance), 3-O-Ethyl Ascorbic Acid, Sodium Hyaluronate, Retinyl Palmitate, Caffeine, Maltodextrin, Centella Asiatica Leaf Extract, Hydroxyethylcellulose, Tocopherol","douds:neu u (Ingredients) : Aqua (Water), Octocrylene, Homosalate, Butyl Methoxydibenzoylmethane, Ethylhexyl Salicylate, Propylene Glycol, C12-15 Alkyl Benzoate, Potassium Cetyl F Phosphate, Phenoxyethanol, Xanthan Gum, Chlorphanesin, Acrylates/C10-30 Alkyl Acrylate Crosspolymer, Silica Dimethyl Silylate, Tilanium Dioxide, Disodium EDTA, Sodium Stearoyl Glutamate, Tocopheryl Acetate, Carbomer, Sodium Hydroxide, Parfum (Fragranco). 3-O-Ethyl Ascorbic Acid, Sodium Hyaluronate, Retinyl Palmitate, Caffeine, Maltodextrin. Centella Asiatica Leaf Extract. Hydroxyethylcellulose, Tocopherol","douds, neu, Aqua (Water), Octocrylene, Homosalate, Butyl, Methoxydibenzoylmethane, Ethylhexyl, Salicylate, Propylene, Glycol, C12-15 Alkyl, Benzoate, Potassium, Cetyl F, Phosphate, Phenoxyethanol, Xanthan, Gum, Chlorphenesin, Acrylates/C10-30 Alkyl Acrylate Crosspolymer, Silica, Dimethyl, Silylate, Tilanium Dioxide, Disodium, EDTA, Sodium, Stearoyl Glutamate, Tocopheryl Acetate, Carbomer, Sodium Hydroxide, Parfum (Fragrance), 3-O-Ethyl Ascorbic Acid, Sodium, Hyaluronate, Retinyl, Palmitate, Caffeine, Maltodextrin, Centella Asiatica, Leaf, Extract, Hydroxyethylcellulose, Tocopherol",556,56,0.0755,0.1964,0.0647,0.3393,54.291,
