dataset,image_file,label_file,status,reference_text,ocr_text_raw,ocr_text_fuzzy,ref_chars,ref_words,cer_raw,wer_raw,cer_fuzzy,wer_fuzzy,ocr_time_sec,error
original,x122.jpg,labelx122.txt,ok,"Aqua, Glycerin, Propylene Glycol, Triethanolamine, Salicylic Acid, Betaine, Acrylates/C10-30 Alkyl Acrylate Crosspolymer, Zanthoxylum Bungeanum Fruit Extract, Panthenol, Ethylhexylglycerin, Paeonia Suffruticosa Root Extract, Caprylhydroxamic Acid, Xanthan Gum, Acrylamide/Sodium Acryloyldimethyltaurate Copolymer, Pentylene Glycol, Ammonium Acrylate, PEG-40 Hydrogenated Castor Oil, Sodium Sulfate, Sodium Hyaluronate, Propanediol, Potassium Hyaluronate, Hydrolyzed Hyaluronic Acid, Hyaluronic Acid, Ceramide NS, Ceramide NP, Ceramide EOS, Ceramide EOP, Ceramide AP, Allantoin, Hydroxyphenyl Propamidobenzoic Acid, Melaleuca Alternifolia (Tea Tree) Leaf Oil, Fragrance, Sodium Hyaluronate Crosspolymer, Sodium Acetylated Hyaluronate, Hydrolyzed Sodium Hyaluronate, Centella Asiatica Leaf Extract, Camellia Sinensis Leaf Extract, Beta-Glucan","[INGREDIENTSJ AQUA, GLYCERIN, PROPYLENE GLYCOL, TRIETHANOLAMINE, SALICYLIC ACID, BETAINE, BUTYLENE GLYCOL, ACRYLATES/C10-30 ALKYL ACRYLATE CROSSPOLYMER, ZANTHOXYLUM BUNGEANUM FRUIT EXTRACT, PANTHENOL, PHENOXYETHANOL ETHYLHEXYLGLYCERIN, PAEONIA SUFFRUTICOSA ROOT EXTRACT, CAPRYLHYDROXAMIC ACID, XANTHAN GUM, ACRYLAMIDE/ SODIUM ACRYLOYLDIMETHYLTAURATE COPOLYMER, PENTYLENE GLYCOL, AMMONIUM SULFATE, PEG-40 HYDROGENATED CASTOR OIL, SODIUM SULFATE, SODIUM HYALURONATE, PROPANEDIOL, POTASSIUM HYALURONATE, HYDROXYPROPYLTRIMONIUM HYALURONATE. HYDROLYZED HYALURONIC ACID, HYALURONIC ACID, CERAMIDE NS, CERAMIDE NP, CERAMIDE EOS, CERAMIDE EOP CERAMIDE AP, ALLANTOIN, HYDROXYPHENYL PROPAMIDOBENZOIC ACID, MELALEUCA ALTERNIFOLIA (TEA TREE) LEAF OIL, FRAGRANCE. SODIUM HYALURONATE CROSSPOLYMER, SODIUM ACETYLATED HYALURONATE, HYDROLYZED SODIUM HYALURONATE, CENTELLA ASIATICA EXTRACT.CAMELLIA SINENSIS LEAF EXTRACT, BETA-GLUCAN","[INGREDIENTSJ AQUA, GLYCERIN, PROPYLENE GLYCOL, TRIETHANOLAMINE, SALICYLIC ACID, BETAINE, BUTYLENE GLYCOL, ACRYLATES/C10-30 ALKYL ACRYLATE CROSSPOLYMER, ZANTHOXYLUM BUNGEANUM FRUIT EXTRACT, PANTHENOL, PHENOXYETHANOL, ETHYLHEXYLGLYCERIN, PAEONIA SUFFRUTICOSA ROOT EXTRACT, CAPRYLHYDROXAMIC ACID, XANTHAN GUM, ACRYLAMIDE/, SODIUM ACRYLOYLDIMETHYLTAURATE CROSSPOLYMER, PENTYLENE GLYCOL, AMMONIUM SULFATE, PEG-40 HYDROGENATED CASTOR, OIL, SODIUM SULFATE, SODIUM HYALURONATE, PROPANEDIOL, POTASSIUM HYALURONATE, HYDROXYPROPYLTRIMONIUM, HYALURONATE. HYDROLYZED HYALURONIC ACID, HYALURONIC ACID, CERAMIDE NG, CERAMIDE NG, CERAMIDE EOS, CERAMIDE EOP, CERAMIDE AP, ALLANTOIN, HYDROXYPHENYL PROPAMIDOBENZOIC ACID, MELALEUCA ALTERNIFOLIA (TEA TREE) LEAF OIL, FRAGRANCE, SODIUM HYALURONATE CROSSPOLYMER, SODIUM ACETYLATED HYALURONATE, HYDROLYZED SODIUM HYALURONATE, CENTELLA, ASIATICA EXTRACT.CAMELLIA SINENSIS LEAF EXTRACT, BETA-GLUCAN",840,88,0.1155,0.1591,0.125,0.1932,62.5387,
original,x123.jpg,labelx123.txt,ok,"Water, Niacinamide, Propanediol, Isononyl Isononanoate, Pentylene Glycol, PEG/PPG-17/6 Copolymer, Polyglyceryl-6 Laurate, Polyglyceryl-10 Oleate, Hydrogenated Polydecene, Butylene Glycol, Phenoxyethanol, Glycogen, Glycolic Acid, Xanthan Gum, Sodium Hydroxide, Sodium Acrylates/Beheneth-25 Methacrylate Crosspolymer, Sorbitan Palmitate, Dipotassium Glycyrrhizate, Lactic Acid, Sodium Magnesium Silicate, Citric Acid, 3-O-Ethyl Ascorbic Acid, Ethylhexylglycerin, 3-Lauryl(glyceryl) Ascorbate, Lauryl Glucoside, Honokiol, Magnolol, Disodium EDTA, Hydrolyzed Sodium Hyaluronate","OUUS:NOU: Water, Niacinamide, Propanediol, Isononyl Isononanoate. Pentylene Glycol, PEG/PPG-17/6 Copolymer, Rolyglyceryl-6 Laurate. utylene Glycol. Sodium Acryiates/Beheneth-25 Methacrylate Crosspolymer. Sorbitam Palmitate. Dipotassium Glycyrrhizate, Lactic Acid, Sodium Magnesium Silicate, Citric Acid. 3-O-Ethyl Ascorbio Acid. Ethylhexylglycerin. 3-Lauryiglyceryl Ascorbate, Lauryl Glucoside, Honokiol, Magnolol,","OUUS, NOU, Water, Niacinamide, Propanediol, Isononyl Isononanoate, Pentylene Glycol, PEG/PPG-17/6 Copolymer, Rolyglyceryl-6 Laurate, utylene Glycol, Sodium Acryiates/Beheneth-25 Methacrylate Crosspolymer. Sorbitam, Palmitate. Dipotassium Glycyrrhizate, Lactic Acid, Sodium Magnesium, Silicate, Citric Acid. 3-O-Ethyl Ascorbio Acid. Ethylhexylglycerin, 3-Lauryiglyceryl Ascorbate, Lauryl Glucoside, Honokiol, Magnolol",573,55,0.3351,0.5818,0.3351,0.5636,63.2433,
original,x124.jpg,labelx124.txt,ok,"Aqua, Kaolin, Glycerin, Cyclopentasiloxane, Bambusa Vulgaris Stem Powder, Glyceryl Stearate, Dimethicone, Isopropyl Myristate, PEG-20 Glyceryl Triisostearate, Polysorbate 60, Stearyl Alcohol, PEG-100 Stearate, Isohexadecane, Fragrance, Synthetic Wax, Titanium Dioxide, Phenoxyethanol, Carbomer, Triethanolamine, Chlorphenesin, Coffea Arabica Seed Powder, Vaccinium Myrtillus Fruit Extract, Saccharum Officinarum Extract, Cocos Nucifera Oil, Disodium EDTA, Niacinamide, Prunus Armeniaca Seed Powder, Citrus Aurantium Dulcis Fruit Extract, Citrus Limon Fruit Extract, Acer Saccharum Extract, Tocopheryl Acetate, Citrullus Lanatus Seed Oil, CI 14720, CI 19140, CI 42090, Hydrolyzed Milk Protein, Momordica Cochinchinensis Fruit Extract, Butylene Glycol, 1,2-Hexanediol, Citrullus Lanatus Fruit Extract, Solanum Lycopersicum Fruit Extract, Citrulline","dwneu (Ingredients): Aqua, Kaolin, Glycerin, Cyclopentasiloxane, Bambusa Vulgaris Stem Powder, Glyceryl Stearate, Dimethicone, Isopropy Myristate 9 Peg-20 Glyceryl Triisostearate, Polysorbate 60, Stearyl Alcohol, Peg-10 Stearate, Isohexadecane 14 Fragrance, Synthetic I Vax, Titanium Dicxide, Phenc yethanol, Carbomer, Triethanolamine, Chlorpher esin, Coffea Arabica Seed Po der, Vaccinium Myrtillus Fruit Extract, Saccharum Officinarum Extract, Cocos Ncifera Ol, Disodlum Edta, Niacinamide, Prunus Armeniaca Seed Powder, Citus Aurantium Dulcis Fruit Extract, Citrus Limon Fru. Extract, Acer SaccharuExtract, Tocopheryl Acetate, Citrullus Lanatus Se. Oil, Ci 14720, Ci 1 40, Ci 42090, Hydrolyzed Milk Protein 37 Momordica Cochinchinensis Fr Extract, Butylene Glycol, 1,2-Hexanediol, Citrullus Lanatus Fruit Extract,anum Lycopersicum Fruit Extract, Citrulline.","Aqua, Kaolin, Glycerin, Cyclopentasiloxane, Bambusa Vulgaris Stem Powder, Glyceryl Stearate, Dimethicone, Isopropy Myristate 9 Peg-20 Glyceryl Triisostearate, Polysorbate 60, Stearyl Alcohol, Peg-10 Stearate, Isohexadecane 14 Fragrance, Synthetic I Vax, Titanium Dicxide, Phenc yethanol, Carbomer, Triethanolamine, Chlorpher esin, Coffea Arabica Seed Po der, Vaccinium Myrtillus Fruit Extract, Saccharum Officinarum Extract, Cocos Ncifera Ol, Disodlum Edta, Niacinamide, Prunus Armeniaca Seed Powder, Citus Aurantium Dulcis Fruit Extract, Citrus, Limon Fru. Extract, Acer SaccharuExtract, Tocopheryl Acetate, Citrullus, Lanatus Se. Oil, Ci 14720, Ci 1 40, Ci 42090, Hydrolyzed Milk Protein, 37 Momordica Cochinchinensis Fr Extract, Butylene Glycol, 1,2-Hexanediol, Citrullus Lanatus Fruit Extract, anum Lycopersicum Fruit Extract, Citrulline",846,96,0.0709,0.3438,0.0461,0.3125,42.4308,
original,x125.jpg,labelx125.txt,ok,"Aqua, Cyclopentasiloxane, Propylene Glycol, Cyclomethicone, Niacinamide, Titanium Dioxide, Dimethicone, Glycerin, Butylene Glycol, Cetyl Dimethicone, Dimethicone Crosspolymer, PEG/PPG-18/18 Dimethicone, Phenoxyethanol, Sodium Chloride, Chlorphenesin, Sodium Polyacrylate, Aloe Barbadensis Leaf Juice Powder, Aluminum Hydroxide, Triethoxycaprylylsilane, Trideceth-6, Tetrahydrodifurfuryloxymethane, Diisopropyl Dimer Dilinoleate, CI 77491, Fragrance, CI 77492, Polyglyceryl-4 Isostearate, Cetyl PEG/PPG-10/1 Dimethicone, Mica, Hyaluronic Acid, C9-15 Fluoroalcohol Phosphate, Glutathione, Prunus Persica Fruit Extract, Oligopeptide-1","GREDIENTS/ đOUUS:NOU : AQUA CYCLCPENTASILOXANE, PROPYLENE GLYCOL, CYCLOMETHICONE, NIACINAMIDE, TITANIUM DIOKIDE, DIMETHICONE, GLYCERIN, BUTYLENE GLYCOL CETYL DIMETHICONE, DIMETHICONE CROSSPOLYMER, PEG/PPG-18/ T DIMETHICONE, PHENOXYETHANOL SODIUM CHLORIDE, CHLORPHENESIN, SODIUM POLYACRYLATE, ALOE BARBADENSIS LEAF JUICE POWDER ALUMINUM HYDROXIDE, TRIETHOXYCAPRYLYLSILANE, TRIDECETH-6, TETRAHYDRODIFERULOYIMETHANE, DIISOPROPYL DIMER DILNOLEATE,  77491, FRAGRANCE, C1 77492, POLYGLYCERYL-4 ISOSTEARATE, CETYL PEG/PPG-10/1 DIMETHICONE, HEXYL LAURATE, C9-15 FLUOROALCOHOL PHOSPHATE, GLUTATHIONE, PRUNUS PERSICA FRUIT EXTRACT. OIGOPEPTIDE-1 1aunlusupamn:10.1.6100007026","GREDIENTS/ đOUUS, NOU, AQUA CYCLCPENTASILOXANE, PROPYLENE GLYCOL, CYCLOMETHICONE, NIACINAMIDE, TITANIUM DIOXIDE, DIMETHICONE, GLYCERIN, BUTYLENE GLYCOL CETYL DIMETHICONE, DIMETHICONE CROSSPOLYMER-3, PEG/PPG-18/, DIMETHICONE, PHENOXYETHANOL SODIUM CHLORIDE, CHLORPHENESIN, SODIUM POLYACRYLATE, ALOE BARBADENSIS LEAF JUICE, POWDER ALUMINUM HYDROXIDE, TRIETHOXYCAPRYLYLSILANE, TRIDECETH-6, TETRAHYDRODIFERULOYIMETHANE, DIISOPROPYL DIMER, DILNOLEATE,  77491, FRAGRANCE, C1 77492, POLYGLYCERYL-10 ISOSTEARATE, CETYL PEG/PPG-7/3 DIMETHICONE, HEXYL, LAURATE, C9-15 FLUOROALCOHOL PHOSPHATE, GLUTATHIONE, PRUNUS PERSICA FRUIT EXTRACT. OIGOPEPTIDE-1, 1aunlusupamn, 10.1.6100007026",631,59,0.141,0.3559,0.1569,0.4237,45.0062,
original,x126.jpg,labelx126.txt,ok,"Aqua, Propanediol, Butylene Glycol, Olive Oil PEG-7 Esters, Polysorbate 20, Glycerin, Sodium Acrylates Copolymer, Snail Secretion Filtrate, Lecithin, Biosaccharide Gum-1, Hydrolyzed Sponge, Croton Lechleri Resin Extract, Ethylhexylglycerin, Hydroxypropyl Guar, Hydroxyethylcellulose, Disodium EDTA, Glyceryl Acrylate/Acrylic Acid Copolymer, Propylene Glycol, PVM/MA Copolymer, Glycolic Acid, Fragrance, Citric Acid, Sodium Magnesium Silicate, Phenoxyethanol, Xanthan Gum, Dipotassium Glycyrrhizate","5s: 8noKun 187-10u AQUA, PROPANEDIOL, BUTYLENE GLYCOL, OLIVE OIL PEG-7 ESTERS, POLYSORBATE 2O, GLYCERIN, SODIUM ACRYLATES COPOLYMER, SNAIL SECRETION FILTRATE, LECITHIN, BIOSACCHARIDE GUM-1, HYDROLYZED SPONGE, CROTON LECHLERI RESIN EXTRACT, ETHYLHEXYLGLYCERIN, HYDROXYPROPYL GUAR, HYDROXYETHYLCELLULOSE, DISODIUM EDTA, GLYCERYL ACRYLATE/ACRYLICACID COPOLYMER, PROPYLENE GLYCOL, PVM/MA COPOLYMER, GLYCOLIC ACID, FRAGRANCE, LACTIC ACID, SODIUM MAGNESIUM SILICATE, CITRIC ACID, PHENOXYETHANOL,XANTHAN GUM, DIPOTASSIUM GLYCYRRHIZATE A en/ kn/Tann","5s, 8noKun 187-10u, AQUA, PROPANEDIOL, BUTYLENE GLYCOL, OLIVE OIL PEG-7 ESTERS, POLYSORBATE 2O, GLYCERIN, SODIUM ACRYLATES CROSSPOLYMER, SNAIL, SECRETION FILTRATE, LECITHIN, BIOSACCHARIDE GUM-1, HYDROLYZED, SPONGE, CROTON LECHLERI RESIN EXTRACT, ETHYLHEXYLGLYCERIN, HYDROXYPROPYL GUAR, HYDROXYETHYLCELLULOSE, DISODIUM EDTA, GLYCERYL, ACRYLATE/ACRYLICACID, COPOLYMER, PROPYLENE, GLYCOL, PVM/MA COPOLYMER, GLYCOLIC ACID, FRAGRANCE, LACTIC, ACID, SODIUM, MAGNESIUM, SILICATE, CITRIC, ACID, PHENOXYETHANOL, XANTHAN GUM, DIPOTASSIUM, GLYCYRRHIZATE, A, en/ kn/Tann",497,53,0.1066,0.2453,0.1368,0.3962,63.7413,
original,x127.jpg,labelx127.txt,ok,"Aqua, Octyl Salicylate, C12-15 Alkyl Benzoate, Isohexadecane, Propanediol, PEG-15/PPG-70 Glyceryl Ether/IPDI/DMPA Copolymer, Dibutyl Adipate, Homosalate, Niacinamide, Titanium Dioxide, Bis-Ethylhexyloxyphenol Methoxyphenyl Triazine, Diethylamino Hydroxybenzoyl Hexyl Benzoate, Acrylates/C12-22 Alkyl Methacrylate Copolymer, C15-19 Alkane, Zinc Oxide, Behenyl Alcohol, Magnesium Aluminum Silicate, Polyglyceryl-10 Pentastearate, Phenoxyethanol, Cucumis Melo Fruit Extract, Propylene Glycol, Polyhydroxystearic Acid, Glycerin, Butylene Glycol, Ethylhexyl Triazone, Hydrated Silica, Chlorphenesin, Diutan Gum, Gossypium Herbaceum Callus Culture, Sodium Stearoyl Lactylate, Pseudoalteromonas Ferment Extract, Aluminum Hydroxide, Neopentyl Glycol Diethylhexanoate, Lecithin, Cetyl Alcohol, Disodium EDTA, Zinc PCA, 1,2-Hexanediol, Avena Sativa Kernel Extract, Biosaccharide Gum-4, Glycyrrhizinate, Hydroxyacetophenone, Citric Acid, Maltodextrin, Aloe Barbadensis Leaf Juice","IUI.n GT UUNUCe ro    n nc   n   Polyhydroxystearic Acid, Glycerin, Butylene Glycol, Ethylhexyl Triazone, Hydrated Sllica, Chlorphenesin, Dlutan Gum, Gossyplum Herbaceum Callus Culture, Sodlum Stearoyl Lactylate, Pseudoalteromonas Ferment Extract, Barbadensis Leaf Juice, Sodium Benzoate  53 7","IUI.n GT UUNUCe, ro, n, nc, n, Polyhydroxystearic Acid, Glycerin, Butylene Glycol, Ethylhexyl Triazone, Hydrated Sllica, Chlorphenesin, Dlutan Gum, Gossyplum Herbaceum Callus, Culture, Sodlum Stearoyl Lactylate, Pseudoalteromonas Ferment Extract, Barbadensis Leaf Juice, Sodium Benzoate, 53 7",968,97,0.7273,0.8144,0.7231,0.8247,42.8355,
original,x128.jpg,labelx128.txt,ok,"Water, Dipropylene Glycol, Glycerin, Niacinamide, Methyl Gluceth-20, Ammonium Acryloyldimethyltaurate/VP Copolymer, Pentaerythrityl Tetraethylhexanoate, Trehalose, Caffeine, Sodium Hyaluronate, Hydroxyacetophenone, Tromethamine, Carbomer, Butylene Glycol, Adenosine, Caprylic/Capric Triglyceride, Caprylyl Glycol, Hydrogenated Lecithin, Disodium EDTA, 1,2-Hexanediol, Ceramide NP, Hamamelis Virginiana (Witch Hazel) Extract, Camellia Sinensis Leaf Extract, Chlorogenic Acids, Collagen, Caffeic Acid, Acetyl Tetrapeptide-5, Ethylhexylglycerin, Arginine, Glycine, Serine, Leucine, Lysine, Histidine, Proline, Phenylalanine, Threonine, Tyrosine, Alanine, Isoleucine, Aspartic Acid, Cystine, Valine, Methionine, Glutamic Acid, Hexapeptide-9, Palmitoyl Pentapeptide-5, Palmitoyl Tripeptide-1, Copper Tripeptide-1, Acetyl Hexapeptide-8","Ingredients/douus:nou: WATER, DIPROPYLENE GLYCOL GLYCERIN, NIACINAMIDE, METHYL GLUCETH-20, AMMONIUM ACRYLOYLDIMETHYLTAURATE/VP COPOLYMER, PENTAERY HRITYL TETRAETHYLHEXANOATE, TREHALOSE, CAFFEINE, SODIUM HYALURONATE, HYDROXYACETOPHENONE, TROMETHAMINE, CARBOMER, BUTYLENE GLYCOL ADENOSINE, CAPRYLIC/CAPRIC TRIGLYCERIDE, CAPRYLYL GLYCOL, HYDRO- GENATED LECITHIN, DISODIUM EDTA, 1,2-HEXANEDIOL, CERAMIDE NP, HAMAMELIS VIRGINIANA (WITCH HAZEL) EXTRACT, CAMELLIA SINENSIS LEAF EXTRACT, CHLOROGENIC ACIDS, COLLAGEN, CAFFEIC ACID, ACETYL TETRAPEPTIDE-5, ETHYLHEXYLGLYCERIN, ARGININE, GLYCINE, SERINE, LEUCINE, LYSINE, HISTIDINE, PROUNE, PHENYLALANINE, THREONINE, TYROSINE, ALANINE, ISOLEUCINE, ASPARTIC ACID, CYSTEINE, VALINE, METHIONINE, GLUTAMIC ACID,HEXAPEPTIDE-9,PALMITOYL PENTAPEPTIDE-5, PALMITOYL TRIPEPTIDE-1, COPPER TRIPEPTIDE-1,ACETYL HEXAPEPTIDE-8.","nou, WATER, DIPROPYLENE GLYCOL GLYCERIN, NIACINAMIDE, METHYL GLUCETH-20, AMMONIUM ACRYLOYLDIMETHYLTAURATE/VP COPOLYMER, PENTAERY HRITYL, TETRAETHYLHEXANOATE, TREHALOSE, CAFFEINE, SODIUM HYALURONATE, HYDROXYACETOPHENONE, TROMETHAMINE, CARBOMER, BUTYLENE GLYCOL, ADENOSINE, CAPRYLIC/CAPRIC TRIGLYCERIDE, CAPRYLYL GLYCOL, HYDRO, GENATED LECITHIN, DISODIUM EDTA, 1,2-HEXANEDIOL, CERAMIDE NG, HAMAMELIS VIRGINIANA (WITCH HAZEL) EXTRACT, CAMELLIA SINENSIS, LEAF EXTRACT, CHLOROGENIC ACIDS, COLLAGEN, CAFFEIC ACID, ACETYL, TETRAPEPTIDE-5, ETHYLHEXYLGLYCERIN, ARGININE, GLYCINE, SERINE, LEUCINE, LYSINE, HISTIDINE, PROUNE, PHENYLALANINE, THREONINE, TYROSINE, ALANINE, ISOLEUCINE, ASPARTIC ACID, CYSTEINE, VALINE, METHIONINE, GLUTAMIC, ACID, HEXAPEPTIDE-49, PALMITOYL PENTAPEPTIDE-5, PALMITOYL TRIPEPTIDE-31, COPPER TRIPEPTIDE-34, ACETYL HEXAPEPTIDE-38",829,78,0.0422,0.1923,0.0265,0.2051,62.3422,
original,x129.jpg,labelx129.txt,ok,"Aqua, Glycereth-26, Niacinamide, Butylene Glycol, Phenoxyethanol, PEG-40 Hydrogenated Castor Oil, Acrylates/C10-30 Alkyl Acrylate Crosspolymer, Citrus Dulcis (Orange) Peel Oil, Glycerin, Hippophae Rhamnoides Fruit Oil, Microcrystalline Cellulose, Sucrose, Hydrolyzed Corn Starch Octenylsuccinate, Zea Mays Starch, Ascorbyl Tetraisopalmitate, Ethyl Ascorbic Acid, Aloe Barbadensis Leaf Juice Powder, Sodium Starch Octenylsuccinate, Hydroxypropyl Methylcellulose, Tocopheryl Acetate, C12-13 Alkyl Glyceryl Hydrolyzed Hyaluronate, Calcium Pantothenate, Maltodextrin, Sodium Ascorbyl Phosphate, Sodium Carboxymethyl Hyaluronate, CI 15985, 1,2-Hexanediol, Caprylyl 2-Glyceryl Ascorbate, Ascorbic Acid, Xanthan Gum, Pyridoxine HCl, Sorbitol, Caprylyl Glycol, Propanediol, CI 17110, CI 12490, Hydrated Silica, Tocopherol, Centella Asiatica Extract, CI 16035, Silica, Glucose, Sodium Hyaluronate, Chondrus Crispus Extract, Colloidal Gold, Hydroxypropyltrimonium Hyaluronate, Glutathione, Hydrolyzed Hyaluronic Acid, Sodium Acetylated Hyaluronate, Hyaluronic Acid, Sodium Hyaluronate Crosspolymer",,,1087,116,1.0,1.0,1.0,1.0,34.7143,
original,x13.jpg,labelx13.txt,ok,"Aqua, Niacinamide, Glycerin, Propylene Glycol, Phenoxyethanol, PEG-40 Hydrogenated Castor Oil, Dipropylene Glycol, Carbomer, Triethanolamine, Chlorphenesin, Soluble Collagen, Tetrasodium EDTA, Fragrance, Glutathione, Sodium Hyaluronate, Polyquaternium-11, Agar, Aloe Barbadensis Leaf Juice Powder, Ethyl Ascorbic Acid, Tocopheryl Acetate, Imidazolidinyl Urea, CI 73360, Methylparaben, Ethylparaben, Butylparaben, Propylparaben","douds:nou/ingredients: nila-nroTacioalo Aqua Propylene Glycol, Soluble Chlorphenesin, Hyaluronate, Ascorbic Acid, Ethylparaben,","douds, nou/ingredients, nila-nroTacioalo, Aqua, Propylene Glycol, Soluble, Chlorphenesin, Hyaluronate, Ascorbic Acid, Ethylparaben",426,43,0.77,0.8372,0.7653,0.8837,59.065,
original,x130.jpg,labelx130.txt,ok,"Water, Propanediol, Niacinamide, Caprylic/Capric Triglyceride, Dimethicone, Isononanoate, Xylitylglucoside, Polyacrylamide, Phenoxyethanol, Anhydroxylitol, Glyceryl Acrylate/Acrylic Acid Copolymer, C13-14 Isoparaffin, Hydrogenated Polyisobutene, Chlorphenesin, Panthenol, Xylitol, Acrylates/C10-30 Alkyl Acrylate Crosspolymer, Triethanolamine, Propylene Glycol, Hydrolyzed Collagen, Butyrospermum Parkii Butter, Betaine, Laureth-7, Saccharide Isomerate, Butylene Glycol, Citrus Limon Fruit Extract, Cetearyl Alcohol, Xanthan Gum, Hydrogenated Lecithin, Petroselinum Crispum Extract, Polysorbate 80, Sodium Hyaluronate, Passiflora Incarnata Extract, Laminaria Digitata Extract, Citric Acid, Sodium Citrate, Linolenic Acid, Ascorbyl Propyl Hyaluronate, Zinc Hydrolyzed Hyaluronate, Potassium Hyaluronate, Hydroxypropyltrimonium Hyaluronate, Pentylene Glycol, Ascorbyl Propyl Hydrolyzed Hyaluronate, Hyaluronic Acid, Dimethylsilanol Hyaluronate, Cholesterol, Ceramide NP, Ceramide NS, Ceramide NG",,,993,96,1.0,1.0,1.0,1.0,45.5431,
original,x131.jpg,labelx131.txt,ok,"Water, C12-15 Alkyl Benzoate, Glycerin, Cyclopentasiloxane, Dimethicone, Ethylhexyl Methoxycinnamate, Titanium Dioxide, Dimethiconol, PEG-10/15 Crosspolymer, Sodium Chloride, Phenoxyethanol, Fragrance, Chlorphenesin, Aloe Barbadensis Leaf Juice Powder, Tocopheryl Acetate, Dipropylene Glycol, Sodium Citrate, CI 15850:1, BHT, Tocopherol, Butylene Glycol, Ascorbyl Tetraisopalmitate, Glutathione, Sodium Hyaluronate, Camellia Japonica Flower Extract, Magnolia Kobus Branch/Flower/Leaf Extract, Nelumbo Nucifera Flower Extract, Citrullus Lanatus Fruit Extract, Aureobasidium Pullulans Ferment, Saccharomyces Ferment, Centella Asiatica Extract, 1,2-Hexanediol, Ethylhexylglycerin, Potassium Sorbate, Sodium Benzoate","Houus:nou Water, C12-15 Alkyl Benzoate, Glycerin, oocrotin.-Oonoiiwnon Cyclopentasiloxane, Dimethicone, Ethylhexyl Methaxycinnamate, Titanium Diaxide, Dimethicone/ PEG-10/15 Crosspolymer, Sodium Chloride, Phenoxyethanol, Fragrance, Chlorphenesin, Aloe Barbadensis Leaf Juice Powder, Tocopheryl Acetate, Dipropylene Glycol, Sodium Citrate, a 15850:1. BHT. Tocopherol, Butylene Glycol, Ascorbyl Tetrai aisopalmitate, Glutathione, Sodium Hyaluronate, CamelliaJaponica Fower Extract, Magnolia Kobus Branch/Flower/Leaf Extract, Nelumbo Nucifera Flower Extract, Citrullus Lanatus Fruit Extract, Aureobasidium Extract, Pullulans Ferment, Saccharomyces .1,2-Hexanediol, Ferment, Centella Asiatica Ethyl Hexanediol, Potassium Sorbate, Sodium Benzoate","Houus, nou, Water, C12-15 Alkyl, Benzoate, Glycerin, oocrotin.-Oonoiiwnon, Cyclopentasiloxane, Dimethicone, Ethylhexyl, Methaxycinnamate, Titanium, Diaxide, Dimethicone/, PEG-10/15, Crosspolymer, Sodium, Chloride, Phenoxyethanol, Fragrance, Chlorphenesin, Aloe, Barbadensis, Leaf, Juice, Powder, Tocopheryl, Acetate, Dipropylene, Glycol, Sodium Citrate, a, 15850, 1, BHT, Tocopherol, Butylene, Glycol, Ascorbyl, Tetrai, aisopalmitate, Glutathione, Sodium, Hyaluronate, CamelliaJaponica, Fower, Extract, Magnolia, Kobus, Branch/Flower/Leaf, Extract, Nelumbo, Nucifera Flower, Extract, Citrullus, Lanatus, Fruit, Extract, Aureobasidium, Extract, Pullulans, Ferment, Saccharomyces, 1,2-Hexanediol, Ferment, Centella Asiatica, Ethyl, Hexanediol, Potassium, Sorbate, Sodium, Benzoate",712,71,0.1419,0.2535,0.1854,0.662,72.3045,
original,x132.jpg,labelx132.txt,ok,"Aqua, Propylene Glycol, Methyl Gluceth-20, Acrylates/C10-30 Alkyl Acrylate Crosspolymer, Niacinamide, Butylene Glycol, Allantoin, Propanediol, Potassium Hydroxide, Ethoxydiglycol, Salicylic Acid, Zinc PCA, Amylopectin, Dextrin, Aloe Barbadensis Leaf Extract, Xanthan Gum, Glycerin, Garcinia Mangostana Peel Extract, Disodium EDTA, Glycolic Acid, Lecithin, Arginine, Dipotassium Glycyrrhizate, Ethylhexylglycerin, Caprylic/Capric Triglyceride, Maltodextrin, Asiaticoside, Madecassic Acid, Quaternium-73, Asiatic Acid, Chamomilla Recutita Flower Extract, Pentylene Glycol, Pistacia Lentiscus Gum, Caproyl Salicylic Acid, Yogurt Powder, Bellis Perennis Flower Extract, Glyceryl Caprylate, Phenethyl Alcohol, Disodium Phosphate, Potassium Chloride, Potassium Phosphate, Sodium Chloride, Phenoxyethanol, Chlorphenesin, O-Cymen-5-OL, Potassium Sorbate, Sodium Benzoate","ssnu: Agua, Propylene Glycol, Methyl Gluceth-20, Acrylates /C10-30 Alkyl Acrylate Crosspolymer, Niacinamide, Butylene Glycol, Allantoin, Propanediol, Potassium Hydroxide, Ethoxydiglycol, Salicylic Acid, Zinc PCA, Amylopectin, Dextrin, Aloe Barbadensis Leaf Extract, Xanthan Gum, Glycerin, Garcinia Mangostana Peel Extract, Disodium EDTA, Lecithin, Arginine, Dipotassium Glycyrrhizate, Ethylhexylglycerin, Glycolic Acid, Polysorbate 60, Calendula Officinalis Flower Extract, Caprylic/Capric Triglyceride, Maltodextrin, Asiaticoside, Madecassic Acid, Quaternium-73, Asiatic Acid, Chamomilla Recutita Flower Extract, Pentylene Glycol, Pistacia Lentiscus Gum, Capryloyl Salicylic Acid, Yogurt Powder, Bellis Perennis Flower Extract, Glyceryl Caprylate, Phenethyl Alcohol, Disodium Phosphate, Potassium Chloride, Potassium Phosphate, Sodium Chloride, Phenoxyethanol, Chlorphenesin, O-Cymen-5-OL, Potassium Sorbate, Sodium Benzoate 000140000016","ssnu, Agua, Propylene Glycol, Methyl Gluceth-20, Acrylates, /C10-30 Alkyl Acrylate Crosspolymer, Niacinamide, Butylene Glycol, Allantoin, Propanediol, Potassium Hydroxide, Ethoxydiglycol, Salicylic, Acid, Zinc PCA, Amylopectin, Dextrin, Aloe Barbadensis Leaf Extract, Xanthan Gum, Glycerin, Garcinia Mangostana Peel Extract, Disodium EDTA, Lecithin, Arginine, Dipotassium Glycyrrhizinate, Ethylhexylglycerin, Glycolic, Acid, Polysorbate 60, Calendula Officinalis Flower Extract, Caprylic/Capric, Triglyceride, Maltodextrin, Asiaticoside, Madecassic Acid, Quaternium-73, Asiatic Acid, Chamomilla Recutita Flower Extract, Pentylene Glycol, Pistacia Lentiscus Gum, Capryloyl Salicylic Acid, Yogurt Powder, Bellis Perennis, Flower Extract, Glyceryl Caprylate, Phenethyl Alcohol, Disodium Phosphate, Potassium Chloride, Potassium Phosphate, Sodium Chloride, Phenoxyethanol, Chlorphenesin, O-Cymen-5-Ol, Potassium Sorbate, Sodium Benzoate, 000140000016",862,89,0.1241,0.1798,0.1334,0.236,50.9131,
original,x133.jpg,labelx133.txt,ok,"Aqua, Butylene Glycol, Niacinamide, Hydrogenated Polydecene, Glycerin, Citrullus Lanatus Fruit Extract, Sodium Hyaluronate, Ethylene Glycol, Polyacrylamide, C13-14 Isoparaffin, Sodium Ascorbyl Phosphate, Tocopheryl Acetate, Phenoxyethanol, Chlorphenesin, Fragrance, Allantoin, Punica Granatum Extract, Collagen, Laureth-7, CI 15985, CI 16255","abuus:nou/Ingredients: Aqua, Butylene Giycol, Niacinamide, nauoUnUamaAAa Hydrogenated Polydecene, Citrullus Lanatus Fruit Extract, Sodium Hyaluronate, Sodium Ascorbyl Phosphate, Phenoxyethanol, Tocopheryl Acetate, C13-14 Isoparaffin. Polyacrylamide. Chlorphenesin, Fragrance, Allantoin, Punica Granatum Extract. Collagen, Laureth-7, Glycerin, Cl 15985, CI 16255","abuus, nou/Ingredients, Aqua, Butylene Giycol, Niacinamide, nauoUnUamaAAa, Hydrogenated Polydecene, Citrullus Lanatus Fruit Extract, Sodium, Hyaluronate, Sodium Ascorbyl Phosphate, Phenoxyethanol, Tocopheryl Acetate, C13-14 Isoparaffin, Polyacrylamide, Chlorphenesin, Fragrance, Allantoin, Punica Granatum Extract, Collagen, Laureth-7, Glycerin, Cl 15985, CI 16255",341,36,0.4428,0.4444,0.4428,0.4722,49.0205,
original,x134.jpg,labelx134.txt,ok,"Water, Butylene Glycol, C12-15 Alkyl Benzoate, Isononyl Isononanoate, Niacinamide (Vitamin B3), Mineral Oil, Cetearyl Alcohol, Dimethicone, Glyceryl PEG-100 Stearate, Panthenol (Vitamin B5), Cyclopentasiloxane, Ethylhexyl Stearate, Cetyl Alcohol, Acrylates/C10-30 Alkyl Acrylate Crosspolymer, Caprylyl Glycol, Fragrance, Chlorphenesin, Potassium Hydroxide, Tetrasodium EDTA, Bisabolol, Carbomer, Limonia Acidissima Extract (Thanaka Extract), Polyacrylamide, PEG-40 Castor Oil, C13-14 Isoparaffin, Sodium Cetearyl Sulfate, Polysorbate 20, Laureth-7, Leuconostoc/Radish Root Ferment Filtrate, Hibiscus Sabdariffa Ferment Extract (Roselle Extract), Sodium Hyaluronate, Tocopheryl Acetate, Morus Alba Bark Extract (Mulberry Extract), Retinyl Palmitate (Vitamin A), Aloe Barbadensis Leaf Juice (Aloe Vera Extract), Maltodextrin, Helianthus Annuus (Sunflower) Seed Oil, Cucumis Sativus (Cucumber) Seed Extract (Cucumber Extract), Sodium Benzoate, Tocopherol, Potassium Phosphate, Potassium Sorbate, BHA, Citric Acid, CI 19140, CI 14700",Bwap C12-15 NZOATE ISONONYL STEARATE CETYL PEG-40 HIBISCUS CITRICA,"Bwap, C12-15, NZOATE, ISONONYL, STEARATE, CETYL, PEG-40, HIBISCUS, CITRICA",1029,116,0.9388,0.9569,0.932,0.9914,52.0647,
